,NDB_No,Descrip,Carb_g,Energy_kcal,Saturated_fats_g,Protein_g,Sodium_mg,Sugar_g,Fat_g
2440,9440,usda cmdty pears cnd lt syrup drnd,16.21,62.0,0.0,0.28,5.0,11.22,0.15
2441,9442,pomegranate juc btld,13.13,54.0,0.077,0.15,9.0,12.65,0.29
2442,9443,juice appl  grape blend w added vit c,12.46,50.0,0.023,0.16,7.0,10.92,0.12
2443,9444,juice appl grape  pear blend w added vit c  ca,12.96,52.0,0.021,0.17,5.0,9.95,0.12
2444,9446,plantains grn fried,49.17,309.0,3.69,1.5,2.0,3.63,11.81
2445,9447,plantains yel fried latino restaurant,40.77,236.0,1.816,1.42,6.0,21.76,7.51
2446,9448,nance cnd syrup drnd,22.79,95.0,0.0,0.56,8.0,15.66,1.28
2447,9449,nance frz unswtnd,16.97,73.0,0.0,0.66,3.0,8.31,1.16
2448,9450,naranjilla (lulo) pulp frz unswtnd,5.9,25.0,0.0,0.44,4.0,3.74,0.22
2449,9451,horned melon (kiwano),7.56,44.0,0.0,1.78,2.0,0.0,1.26
2450,9452,orange pnappl juc blend,12.2,51.0,0.011,0.41,4.0,10.57,0.08
2451,9500,apples raw red delicious w skn,14.06,59.0,0.0,0.27,1.0,10.48,0.2
2452,9501,apples raw golden delicious w skn,13.6,57.0,0.0,0.28,2.0,10.04,0.15
2453,9502,apples raw granny smith w skn,13.61,58.0,0.0,0.44,1.0,9.59,0.19
2454,9503,apples raw gala w skn,13.68,57.0,0.0,0.25,1.0,10.37,0.12
2455,9504,apples raw fuji w skn,15.22,63.0,0.0,0.2,1.0,11.68,0.18
2456,9506,orange juc chilled incl from conc w add ca  vitamins a d e,11.54,49.0,0.0139999999999999,0.68,2.0,8.31,0.12
2457,9507,fruit juc smoothie naked juc mighty mango,15.0,63.0,0.0,0.42,4.0,12.5,0.0
2458,9508,fruit juc smoothie naked juc grn machine,12.53,53.0,0.053,0.6,6.0,11.15,0.26
2459,9510,pineapple juc cnd not from conc unswtnd w add vit a c  e,12.18,50.0,0.0,0.36,3.0,9.98,0.14
2460,9511,fruit juc smoothie naked juc blue machine,16.67,71.0,0.0,0.42,4.0,12.08,0.0
2461,9512,grape juc cnd or btld unswtnd w added vit c  ca,14.77,62.0,0.025,0.37,5.0,14.2,0.13
2462,9513,fruit juc smoothie odwalla original superfood,11.51,50.0,0.105,0.63,3.0,10.16,0.36
2463,9514,fruit juc smoothie bolthouse farms berry boost,10.9,46.0,0.003,0.63,4.0,9.3,0.02
2464,9515,fruit juc smoothie bolthouse farms grn goodness,13.04,56.0,0.068,0.63,11.0,11.46,0.33
2465,9516,fruit juc smoothie bolthouse farms strawberry banana,12.37,52.0,0.129,0.44,5.0,10.33,0.3
2466,9517,apple juc cnd or btld unswtnd w added vit c ca  k,11.49,48.0,0.0289999999999999,0.12,5.0,9.47,0.17
2467,9518,raspberries frz unswtnd,11.94,52.0,0.0,1.2,1.0,4.42,0.65
2468,9519,guava nectar w sucralose cnd,13.3,48.0,0.023,0.3,6.0,10.15,0.07
2469,9520,kiwifruit zespri sungold raw,15.79,63.0,0.065,1.02,3.0,12.3,0.28
2470,9522,cranberry juc blend 100 juc btld w added vit c  ca,10.91,45.0,0.002,0.27,6.0,9.8,0.12
2471,9523,lemon juc from conc btld concord,5.37,24.0,0.0,0.4,29.0,1.42,0.07
2472,9524,lemon juc from conc btld real lemon,5.66,17.0,0.027,0.47,26.0,1.59,0.07
2473,9525,cranberry sau whl cnd ocean spray,40.4,158.0,0.0069999999999999,0.75,5.0,31.3,0.05
2474,9526,cranberry sau jellied cnd ocean spray,40.61,160.0,0.0069999999999999,1.05,5.0,32.2,0.04
2475,9528,ruby red grpfrt juc blnd (grpfrt grp apl) ocean spry wvit c,10.53,44.0,0.008,0.5,8.0,10.3,0.1
2476,9530,fruit juc smoothie odwalla strawberry banana,11.05,48.0,0.12,0.5,2.0,9.9,0.32
2477,9531,fruit juc smoothie naked juc strawberry banana,11.66,50.0,0.092,0.48,2.0,10.05,0.27
2478,10000,pork frsh comp of fat w added soln ckd,0.32,585.0,21.382,10.06,125.0,0.0,60.42
2479,10001,pork frsh carcass lnfat raw,0.0,376.0,12.44,13.91,42.0,0.0,35.07
2480,10002,pork frsh comp of rtl cuts (leg loin shldr) ln raw,0.0,134.0,1.625,21.2,59.0,0.0,4.86
2481,10003,pork frsh comp of leg loin shldr  spareribs ln  fat raw,0.0,211.0,4.918,18.22,57.0,0.0,14.79
2482,10004,pork fresh backfat raw,0.0,812.0,32.21,2.92,11.0,0.0,88.69
2483,10005,pork frsh belly raw,0.0,518.0,19.33,9.34,32.0,0.0,53.01
2484,10006,pork frsh fat raw,0.0,632.0,21.979,9.25,47.0,0.0,65.7
2485,10007,pork frsh fat ckd,0.0,626.0,23.856,7.06,56.0,0.0,66.1
2486,10008,pork frsh leg (ham) whl lnfat raw,0.0,245.0,6.54,17.43,47.0,0.0,18.87
2487,10009,pork frsh leg (ham) whl lnfat ckd rstd,0.0,273.0,6.47,26.83,60.0,0.0,17.61
2488,10010,pork frsh leg (ham) whl ln raw,0.0,136.0,1.87,20.48,55.0,0.0,5.41
2489,10011,pork frsh leg (ham) whl ln ckd rstd,0.0,211.0,3.3,29.41,64.0,0.0,9.44
2490,10012,pork frsh leg (ham) rump half lnfat raw,0.0,182.0,3.526,20.27,73.0,0.0,10.63
2491,10013,pork frsh leg (ham) rump half lnfat ckd rstd,0.0,209.0,3.369,27.03,77.0,0.0,10.32
2492,10014,pork frsh leg (ham) rump half ln raw,0.0,120.0,0.947,21.81,76.0,0.0,2.93
2493,10015,pork frsh leg (ham) rump half ln ckd rstd,0.0,165.0,1.4510000000000000,28.86,80.0,0.0,4.62
2494,10016,pork frsh leg (ham) shank half lnfat raw,0.0,193.0,3.942,19.87,84.0,0.0,11.96
2495,10017,pork frsh leg (ham) shank half lnfat ckd rstd,0.0,232.0,4.609,25.96,81.0,0.0,13.42
2496,10018,pork frsh leg (ham) shank half ln raw,0.0,119.0,0.917,21.66,90.0,0.0,2.95
2497,10019,pork frsh leg (ham) shank half ln ckd rstd,0.0,175.0,1.837,28.69,84.0,0.0,5.83
2498,10020,pork frsh loin whl lnfat raw,0.0,198.0,4.36,19.74,50.0,0.0,12.58
2499,10021,pork frsh loin whl lnfat ckd brsd,0.0,239.0,5.11,27.23,48.0,0.0,13.62
2500,10022,pork frsh loin whl lnfat ckd brld,0.0,242.0,5.23,27.32,62.0,0.0,13.92
2501,10023,pork frsh loin whl lnfat ckd rstd,0.0,248.0,5.37,27.09,59.0,0.0,14.65
2502,10024,pork frsh loin whl ln raw,0.0,143.0,1.95,21.43,52.0,0.0,5.66
2503,10025,pork frsh loin whl ln ckd brsd,0.0,204.0,3.38,28.57,50.0,0.0,9.12
2504,10026,pork frsh loin whl ln ckd brld,0.0,210.0,3.64,28.57,64.0,0.0,9.8
2505,10027,pork frsh loin whl ln ckd rstd,0.0,209.0,3.51,28.62,58.0,0.0,9.63
2506,10028,pork frsh loin blade (chops or roasts) bone-in lnfat raw,0.0,194.0,4.27,19.56,69.0,0.0,12.27
2507,10029,pork frsh loin blade (chops) bone-in lnfat ckd brsd,0.0,255.0,4.487,26.54,69.0,0.0,15.71
2508,10030,pork frsh loin blade (chops) bone-in lnfat ckd brld,0.0,231.0,4.339,23.72,74.0,0.0,14.35
2509,10031,pork frsh loin blade (roasts) bone-in lnfat ckd rstd,0.0,254.0,5.9,24.29,76.0,0.0,16.71
2510,10032,pork frsh loin blade (chops or roasts) bone-in ln raw,0.0,143.0,1.974,21.22,73.0,0.0,5.84
2511,10033,pork frsh loin blade (chops) bone-in ln ckd brsd,0.0,222.0,2.59,28.02,70.0,0.0,11.29
2512,10034,pork frsh loin blade (chops) bone-in ln ckd brld,0.0,193.0,2.322,24.99,76.0,0.0,9.56
2513,10035,pork frsh loin blade (roasts) bone-in ln ckd rstd,0.0,217.0,3.934,25.7,78.0,0.0,11.89
2514,10036,pork frsh loin cntr loin (chops) bone-in ln  fat raw,0.0,170.0,2.9930000000000000,20.71,55.0,0.0,9.03
2515,10037,pork frsh loin cntr loin (chops) bone-in lnfat ckd brsd,0.0,242.0,4.934,28.21,73.0,0.0,13.51
2516,10038,pork frsh loin cntr loin (chops) bone-in lnfat ckd brld,0.0,209.0,3.518,25.61,55.0,0.0,11.06
2517,10039,pork frsh loin cntr loin (roasts) bone-in lnfat ckd rstd,0.0,231.0,4.859,27.01,83.0,0.0,12.8
2518,10040,pork frsh loin cntr loin (chops) bone-in ln raw,0.0,127.0,1.098,21.99,58.0,0.0,3.71
2519,10041,pork frsh loin cntr loin (chops) bone-in ln ckd brsd,0.0,200.0,2.6710000000000000,30.2,75.0,0.0,7.86
2520,10042,pork frsh loin cntr loin (chops) bone-in ln ckd brld,0.0,180.0,2.156,26.76,56.0,0.0,7.29
2521,10043,pork frsh loin cntr loin (roasts) bone-in ln ckd rstd,0.0,194.0,2.932,28.58,86.0,0.0,7.95
2522,10044,pork frsh loin cntr rib (chops or roasts) bone-in lnfat raw,0.0,186.0,2.365,20.28,56.0,0.0,11.04
2523,10045,pork frsh loin cntr rib (chops) bone-in lnfat ckd brsd,0.0,261.0,5.435,26.66,70.0,0.0,16.28
2524,10046,pork frsh loin cntr rib (chops) bone-in lnfat ckd brld,0.0,222.0,4.486000000000000,24.42,55.0,0.0,13.04
2525,10047,pork frsh loin cntr rib (roasts) bone-in lnfat ckd rstd,0.0,248.0,5.442,26.99,91.0,0.0,14.68
2526,10048,pork frsh loin cntr rib (chops or roasts) bone-in ln raw,0.0,136.0,1.617,21.79,60.0,0.0,4.8
2527,10049,pork frsh loin cntr rib (chops) bone-in ln ckd brsd,0.0,208.0,2.389,29.03,72.0,0.0,9.32
2528,10050,pork frsh loin cntr rib (chops) bone-in ln ckd brld,0.0,186.0,2.8160000000000000,25.79,57.0,0.0,8.36
2529,10051,pork frsh loin cntr rib (roasts) bone-in ln ckd rstd,0.0,206.0,3.254,28.82,95.0,0.0,9.21
2530,10052,pork frsh loin sirloin (chops or roasts) bone-in lnfat raw,0.0,168.0,1.851,20.48,57.0,0.0,8.96
2531,10053,pork frsh loin sirloin (chops) bone-in lnfat ckd brsd,0.0,234.0,4.294,28.81,58.0,0.0,12.31
2532,10054,pork frsh loin sirloin (chops) bone-in lnfat ckd brld,0.0,222.0,4.045,26.96,86.0,0.0,11.82
2533,10055,pork frsh loin sirloin (roasts) bone-in lnfat ckd rstd,0.0,230.0,4.113,26.64,57.0,0.0,12.87
2534,10056,pork frsh loin sirloin (chops or roasts) bone-in ln raw,0.0,129.0,0.0,21.65,59.0,0.0,4.02
2535,10057,pork frsh loin sirloin (chops) bone-in ln ckd brsd,0.0,195.0,2.327,31.0,58.0,0.0,6.9
2536,10058,pork frsh loin sirloin (chops) bone-in ln ckd brld,0.0,174.0,1.7180000000000000,29.29,89.0,0.0,5.45
2537,10059,pork frsh loin sirloin (roasts) bone-in ln ckd rstd,0.0,204.0,2.8710000000000000,27.78,59.0,0.0,9.44
2538,10060,pork  frsh  loin  tenderloin   ln only  raw,0.0,109.0,0.698,20.95,53.0,0.0,2.17
2539,10061,pork frsh loin tenderloin ln ckd rstd,0.0,143.0,1.198,26.17,57.0,0.0,3.51
2540,10062,pork frsh loin top loin (chops) bnless ln  fat raw,0.0,155.0,2.45,21.55,48.0,0.0,6.94
2541,10063,pork frsh loin top loin (chops) bnless ln  fat ckd brsd,0.0,200.0,3.218,29.2,66.0,0.0,8.31
2542,10064,pork frsh loin top loin (chops) bnless ln  fat ckd brld,0.0,196.0,3.164,26.62,44.0,0.0,9.14
2543,10065,pork frsh loin top loin (roasts) bnless lnfat ckd rstd,0.0,192.0,2.839,26.45,46.0,0.0,8.82
2544,10066,pork frsh loin top loin (chops) bnless ln raw,0.0,127.0,1.208,22.41,49.0,0.0,3.42
2545,10067,pork frsh loin top loin (chops) bnless ln ckd brsd,0.0,170.0,1.6570000000000000,30.54,67.0,0.0,4.34
2546,10068,pork frsh loin top loin (chops) bnless ln ckd brld,0.0,173.0,2.077,27.58,45.0,0.0,6.08
2547,10069,pork frsh loin top loin (roasts) bnless ln ckd rstd,0.0,173.0,1.927,27.23,47.0,0.0,6.28
2548,10070,pork frsh shldr whl lnfat raw,0.0,236.0,6.24,17.18,65.0,0.0,17.99
2549,10071,pork frsh shldr whl lnfat ckd rstd,0.0,292.0,7.86,23.28,68.0,0.0,21.39
2550,10072,pork frsh shldr whl ln raw,0.0,148.0,2.47,19.55,76.0,0.0,7.14
2551,10073,pork frsh shldr whl ln ckd rstd,0.0,230.0,4.79,25.33,75.0,0.0,13.54
2552,10074,pork frsh shldr arm picnic lnfat raw,0.0,193.0,4.14,18.71,84.0,0.0,12.51
2553,10075,pork frsh shldr arm picnic lnfat ckd brsd,0.0,235.0,4.854,24.88,96.0,0.0,14.33
2554,10076,pork frsh shldr arm picnic lnfat ckd rstd,0.0,317.0,8.78,23.47,70.0,0.0,24.01
2555,10077,pork frsh shldr arm picnic ln raw,0.0,120.0,1.206,20.26,90.0,0.0,3.77
2556,10078,pork frsh shldr arm picnic ln ckd brsd,0.0,194.0,2.85,26.76,100.0,0.0,8.87
2557,10079,pork frsh shldr arm picnic ln ckd rstd,0.0,228.0,4.3,26.68,80.0,0.0,12.62
2558,10080,pork frsh shldr (boston butt) blade (steaks) ln  fat raw,0.0,186.0,4.348,17.42,61.0,0.0,12.36
2559,10081,pork frsh shldr (boston butt) blade (stks) ln  fat ckd brsd,0.0,267.0,6.584,25.07,58.0,0.0,17.69
2560,10082,pork frsh shldr blade boston (steaks) lnfat ckd brld,0.0,259.0,5.95,25.58,69.0,0.0,16.61
2561,10083,pork frsh shldr blade boston (roasts) lnfat ckd rstd,0.0,269.0,6.97,23.11,67.0,0.0,18.86
2562,10084,pork frsh shldr (boston butt) blade (steaks) ln raw,0.0,132.0,1.998,18.73,65.0,0.0,5.71
2563,10085,pork frsh shldr (boston butt) blade (steaks) ln ckd brsd,0.0,233.0,5.023,26.57,60.0,0.0,13.2
2564,10086,pork frsh shldr blade boston (steaks) ln ckd brld,0.0,227.0,4.45,26.74,74.0,0.0,12.54
2565,10087,pork frsh shldr blade boston (roasts) ln ckd rstd,0.0,232.0,5.19,24.21,88.0,0.0,14.3
2566,10088,pork frsh spareribs lnfat raw,0.0,277.0,7.529,15.47,81.0,0.0,23.4
2567,10089,pork frsh spareribs lnfat ckd brsd,0.0,397.0,11.12,29.06,93.0,0.0,30.3
2568,10093,pork frsh comp of rtl cuts (leg loin shldr) ln ckd,0.0,201.0,3.092,27.51,55.0,0.0,9.21
2569,10094,pork frsh loin cntr loin (chops) bnless ln raw,0.0,123.0,0.8010000000000000,23.75,87.0,0.0,3.09
2570,10096,pork frsh var meatsby-products brain raw,0.0,127.0,2.079,10.28,120.0,0.0,9.21
2571,10097,pork frsh var meatsby-products brain ckd brsd,0.0,138.0,2.15,12.14,91.0,0.0,9.51
2572,10098,pork frsh var meatsby-products chitterlings raw,0.0,182.0,7.619,7.64,24.0,0.0,16.61
2573,10099,pork frsh var meatsby-products chitterlings ckd simmrd,0.0,233.0,9.52,12.49,18.0,0.0,20.32
2574,10100,pork frsh var meatsby-products ears frz raw,0.6,234.0,5.39,22.45,191.0,0.0,15.1
2575,10101,pork frsh var meatsby-products ears frz ckd simmrd,0.2,166.0,3.86,15.95,167.0,0.0,10.8
2576,10102,pork frsh var meatsby-products feet raw,0.0,212.0,3.57,23.16,132.0,0.0,12.59
2577,10103,pork frsh var meatsby-products heart raw,1.33,118.0,1.16,17.27,56.0,0.0,4.36
2578,10104,pork frsh var meatsby-products heart ckd brsd,0.4,148.0,1.34,23.6,35.0,0.0,5.05
2579,10105,pork frsh var meatsby-products jowl raw,0.0,655.0,25.26,6.38,25.0,0.0,69.61
2580,10106,pork frsh var meatsby-products kidneys raw,0.0,100.0,1.04,16.46,121.0,0.0,3.25
2581,10107,pork frsh var meatsby-products kidneys ckd brsd,0.0,151.0,1.51,25.4,80.0,0.0,4.7
2582,10109,pork frsh var meatsby-products leaf fat raw,0.0,857.0,45.23,1.76,5.0,0.0,94.16
2583,10110,pork frsh var meatsby-products liver raw,2.47,134.0,1.17,21.39,87.0,0.0,3.65
2584,10111,pork frsh var meatsby-products liver ckd brsd,3.76,165.0,1.41,26.02,49.0,0.0,4.4
2585,10112,pork frsh var meatsby-products lungs raw,0.0,85.0,0.96,14.08,153.0,0.0,2.72
2586,10113,pork frsh var meatsby-products lungs ckd brsd,0.0,99.0,1.09,16.6,81.0,0.0,3.1
2587,10114,pork frsh var meatsby-products mechanically separated raw,0.0,304.0,9.82,15.03,50.0,0.0,26.54
2588,10115,pork frsh var meatsby-products pancreas raw,0.0,199.0,4.58,18.56,44.0,0.0,13.24
2589,10116,pork frsh var meatsby-products pancreas ckd brsd,0.0,219.0,3.73,28.5,42.0,0.0,10.8
2590,10117,pork frsh var meatsby-products spleen raw,0.0,100.0,0.86,17.86,98.0,0.0,2.59
2591,10118,pork frsh var meatsby-products spleen ckd brsd,0.0,149.0,1.06,28.2,107.0,0.0,3.2
2592,10119,pork frsh var meatsby-products stomach raw,0.0,159.0,4.025,16.85,75.0,0.0,10.14
2593,10120,pork frsh loin blade (chops) bone-in ln ckd pan-fried,0.0,222.0,2.557,26.38,88.0,0.0,12.14
2594,10121,pork frsh var meatsby-products tongue raw,0.0,225.0,5.96,16.3,110.0,0.0,17.2
2595,10122,pork frsh var meatsby-products tongue ckd brsd,0.0,271.0,6.449,24.1,109.0,0.0,18.6
2596,10123,pork cured bacon unprep,1.28,417.0,13.296,12.62,662.0,1.0,39.69
2597,10128,pork cured brkfst strips raw or unhtd,0.7,388.0,12.91,11.74,987.0,0.0,37.16
2598,10130,canadian bacon unprep,1.34,110.0,0.9,20.31,751.0,0.9,2.62
2599,10132,pork cured feet pickled,0.01,140.0,2.945,11.63,946.0,0.0,10.02
2600,10134,pork cured ham bnless ex ln (approx 5 fat) rstd,1.5,145.0,1.81,20.93,1203.0,0.0,5.53
2601,10136,pork cured ham bnless reg (approx 11 fat) rstd,0.0,178.0,3.12,22.62,1500.0,0.0,9.02
2602,10137,pork cured ham ex ln (approx 4 fat) cnd unhtd,0.0,120.0,1.51,18.49,1255.0,0.0,4.56
2603,10138,pork cured ham ex ln (approx 4 fat) cnd rstd,0.52,136.0,1.6,21.16,1135.0,0.0,4.88
2604,10140,pork cured ham reg (approx 13 fat) cnd rstd,0.42,226.0,5.04,20.53,941.0,0.0,15.2
2605,10141,pork cured ham cntr slice country-style ln raw,0.3,195.0,2.78,27.8,2695.0,0.0,8.32
2606,10142,pork cured ham cntr slice lnfat unhtd,0.05,203.0,4.572,20.17,1386.0,0.0,12.9
2607,10146,pork cured ham patties unhtd,1.69,315.0,10.13,12.78,1088.0,0.0,28.19
2608,10149,pork cured ham steak bnless ex ln unhtd,0.0,122.0,1.44,19.56,1269.0,0.0,4.25
2609,10150,pork cured ham whl lnfat unhtd,0.06,246.0,6.62,18.49,1284.0,0.0,18.52
2610,10152,pork cured ham whl ln unhtd,0.05,147.0,1.92,22.32,1516.0,0.0,5.71
2611,10153,pork cured ham whl ln rstd,0.0,157.0,1.84,25.05,1327.0,0.0,5.5
2612,10158,usda cmdty pork cnd,0.59,196.0,4.225,19.4,213.0,0.0,12.95
2613,10163,pork frsh loin cntr loin (chops) bnless ln ckd pan-broiled,0.0,162.0,1.658,30.02,91.0,0.0,4.65
2614,10164,pork frsh loin cntr loin (chops) bnless ln  fat raw,0.0,201.0,4.413,21.14,82.0,0.0,12.96
2615,10165,pork cured salt pork raw,0.0,748.0,29.38,5.05,2684.0,0.0,80.5
2616,10166,pork cured fat (from hamarm picnic) unhtd,0.09,579.0,22.52,5.68,505.0,0.0,61.41
2617,10167,pork cured fat (from hamarm picnic) rstd,0.0,591.0,22.69,7.64,624.0,0.0,61.86
2618,10168,pork cured shldr arm picnic lnfat rstd,0.0,280.0,7.67,20.43,1072.0,0.0,21.35
2619,10169,pork cured shldr arm picnic ln rstd,0.0,170.0,2.36,24.94,1231.0,0.0,7.04
2620,10170,pork cured shldr blade roll lnfat unhtd,0.0,269.0,7.939,16.47,1250.0,0.0,21.98
2621,10171,pork cured shldr blade roll lnfat rstd,0.37,287.0,8.38,17.28,973.0,0.0,23.48
2622,10173,pork frsh var meatsby-products feet ckd simmrd,0.0,238.0,4.343,21.94,73.0,0.0,16.05
2623,10174,pork frsh var meatsby-products tail raw,0.0,378.0,11.64,17.75,63.0,0.0,33.5
2624,10175,pork frsh var meatsby-products tail ckd simmrd,0.0,396.0,12.45,17.0,25.0,0.0,35.8
2625,10176,pork frsh loin cntr loin (chops) bone-in ln ckd pan-fried,0.0,195.0,2.597,29.56,99.0,0.0,7.66
2626,10177,pork frsh loin cntr rib (chops) bone-in ln ckd pan-fried,0.0,211.0,2.563,28.84,88.0,0.0,9.73
2627,10178,pork frsh loin blade (chops) bone-in lnfat ckd pan-fried,0.0,256.0,4.266,25.02,85.0,0.0,16.56
2628,10179,pork frsh loin cntr loin chops bone-in lnfat ckd pan-fried,0.0,238.0,4.867,27.63,94.0,0.0,13.32
2629,10180,pork frsh loin cntr rib (chops) bone-in lnfat ckd pan-fried,0.0,256.0,5.056,26.81,84.0,0.0,15.71
2630,10181,pork frsh loin top loin (chops) bnless ln ckd pan-fried,0.0,172.0,1.784,30.46,87.0,0.0,4.62
2631,10182,pork cured ham bnless ex lnreg unhtd,2.28,162.0,2.7,18.26,1278.0,0.0,8.39
2632,10183,pork cured ham bnless ex lnreg rstd,0.5,165.0,2.61,21.97,1385.0,0.0,7.66
2633,10184,pork cured ham ex lnreg cnd unhtd,0.0,144.0,2.45,17.97,1276.0,0.0,7.46
2634,10185,pork cured ham ex lnreg cnd rstd,0.49,167.0,2.81,20.94,1068.0,0.0,8.43
2635,10186,pork frsh loin top loin (chops) bnless lnfat ckd pan-fried,0.0,196.0,3.0580000000000000,29.36,86.0,0.0,7.86
2636,10187,pork frsh comp (leg loin shldr spareribs) lnfat raw,0.0,216.0,5.28,18.95,55.0,0.0,14.95
2637,10188,pork frsh comp (leg loin shldr spareribs) lnfat ckd,0.0,238.0,4.893,26.36,57.0,0.0,13.89
2638,10189,pork frsh loin cntr lon (chps) bnless ln  fat ckd pan-brled,0.0,229.0,4.89,26.68,86.0,0.0,13.6
2639,10192,pork frsh backribs lnfat raw,0.0,224.0,5.783,19.07,87.0,0.0,16.33
2640,10193,pork frsh backribs lnfat ckd rstd,0.0,292.0,7.8,23.01,94.0,0.0,21.51
2641,10194,pork frsh loin cntr rib (chops or roasts) bnless lnfat raw,0.0,211.0,4.86,19.9,42.0,0.0,14.01
2642,10195,pork frsh loin cntr rib (chops) bnless lnfat ckd brsd,0.0,255.0,6.12,26.29,40.0,0.0,15.79
2643,10196,pork frsh loin cntr rib (chops) bnless lnfat ckd brld,0.0,260.0,5.79,27.63,62.0,0.0,15.76
2644,10197,pork frsh loin cntr rib (chops) bnless lnfat ckd pan-fried,0.0,273.0,6.72,25.82,50.0,0.0,18.05
2645,10198,pork frsh loin cntr rib (roasts) bnless lnfat ckd rstd,0.0,252.0,5.35,26.99,48.0,0.0,15.15
2646,10199,pork frsh loin cntr rib (chops or roasts) bnless ln raw,0.0,152.0,2.24,21.8,45.0,0.0,6.48
2647,10200,pork frsh loin cntr rib (chops) bnless ln ckd brsd,0.0,211.0,3.96,27.95,41.0,0.0,10.14
2648,10201,pork frsh loin cntr rib (chops) bnless ln ckd brld,0.0,216.0,3.57,29.46,65.0,0.0,10.05
2649,10202,pork frsh loin cntr rib (chops) bnless ln ckd pan-fried,0.0,224.0,4.3,27.68,52.0,0.0,11.8
2650,10203,pork frsh loin cntr rib (roasts) bnless ln ckd rstd,0.0,214.0,3.54,28.81,50.0,0.0,10.13
2651,10204,pork frsh loin country-style ribs lnfat raw,0.0,189.0,2.37,19.34,63.0,0.0,11.82
2652,10205,pork frsh loin country-style ribs lnfat ckd brsd,0.0,273.0,6.3020000000000000,26.49,58.0,0.0,17.71
2653,10206,pork frsh loin country-style ribs ln  fat bone-in ckd rstd,0.0,359.0,10.689,21.75,52.0,0.0,29.46
2654,10207,pork frsh loin country-style ribs ln raw,0.0,140.0,2.012,20.76,67.0,0.0,5.64
2655,10208,pork frsh loin country-style ribs ln ckd brsd,0.0,247.0,5.086,27.74,60.0,0.0,14.26
2656,10209,pork frsh loin country-style ribs ln bone-in ckd rstd,0.0,227.0,3.766,29.2,91.0,0.0,11.38
2657,10210,pork frsh loin sirloin (chops or roasts) bnless lnfat raw,0.0,133.0,1.393,22.49,63.0,0.0,4.05
2658,10211,pork frsh loin sirloin (chops) bnless lnfat ckd brsd,0.0,171.0,1.87,28.41,56.0,0.0,5.47
2659,10212,pork frsh loin sirloin (chops) bnless lnfat ckd brld,0.0,170.0,1.785,28.19,65.0,0.0,5.53
2660,10213,pork frsh loin sirloin (roasts) bnless lnfat ckd rstd,0.0,192.0,2.528,29.62,66.0,0.0,7.32
2661,10214,pork frsh loin sirloin (chops or roasts) bnless ln raw,0.0,121.0,0.906,22.81,63.0,0.0,2.59
2662,10215,pork frsh loin sirloin (chops) bnless ln ckd brsd,0.0,163.0,1.517,28.75,56.0,0.0,4.5
2663,10216,pork frsh loin sirloin (chops) bnless ln ckd brld,0.0,161.0,1.357,28.6,66.0,0.0,4.36
2664,10217,pork frsh loin sirloin (roasts) bnless ln ckd rstd,0.0,178.0,1.798,30.39,66.0,0.0,5.31
2665,10218,pork frsh loin tenderloin lnfat raw,0.0,120.0,1.181,20.65,52.0,0.0,3.53
2666,10219,pork fresh ground raw,0.0,263.0,7.87,16.88,56.0,0.0,21.19
2667,10220,pork fresh ground cooked,0.0,297.0,7.72,25.69,73.0,0.0,20.77
2668,10221,pork frsh loin tenderloin lnfat ckd brld,0.0,201.0,2.93,29.86,64.0,0.0,8.11
2669,10222,pork frsh loin tenderloin lnfat ckd rstd,0.0,147.0,1.358,26.04,57.0,0.0,3.96
2670,10223,pork frsh loin tenderloin ln ckd brld,0.0,187.0,2.24,30.42,65.0,0.0,6.33
2671,10224,pork frsh loin top loin (roasts) bnless lnfat raw,0.0,166.0,1.598,21.34,47.0,0.0,8.33
2672,10225,pork frsh loin top loin (roasts) bnless ln raw,0.0,132.0,1.248,22.39,49.0,0.0,4.06
2673,10226,pork frsh comp of rtl cuts (loin  shldr blade) ln  fat raw,0.0,177.0,3.1060000000000000,20.08,54.0,0.0,10.14
2674,10227,pork frsh comp of rtl cuts (loinshldr blade) lnfat ckd,0.0,235.0,4.703,26.07,55.0,0.0,13.66
2675,10228,pork frsh comp of rtl cuts (loinshldr blade) ln raw,0.0,144.0,2.03,21.23,54.0,0.0,5.88
2676,10229,pork frsh comp of rtl cuts (loinshldr blade) ln ckd,0.0,211.0,3.34,29.47,57.0,0.0,9.44
2677,10802,usda commodity pork cured ham bnless ckd htd,0.0,149.0,1.7010000000000000,18.84,1155.0,0.0,7.62
2678,10803,usda commodity pork ground finecoarse frz ckd,0.0,265.0,5.515,23.55,76.0,0.0,18.19
2679,10804,usda commodity pork cured ham bnless ckd unhtd,0.69,133.0,1.673,17.44,1210.0,0.0,6.16
2680,10805,usda commodity pork ground finecoarse frz raw,0.0,221.0,6.379,15.41,58.0,0.0,17.18
2681,10851,hormel cure 81 ham,0.21,106.0,1.17,18.43,1038.0,0.0,3.59
2682,10852,hormel always tender pork tenderloin teriyaki-flavored,4.63,119.0,1.05,18.2,413.0,3.33,3.07
2683,10853,hormel always tender pork tenderloin peppercorn-flavored,1.82,110.0,1.16,17.21,594.0,0.14,3.8
2684,10854,hormel always tender pork loin filets lemon garlic-flavored,1.79,118.0,1.41,17.83,590.0,0.22,4.16
2685,10855,hormel always tender cntr cut chops frsh pork,0.84,167.0,3.6,18.74,378.0,0.28,9.62
2686,10856,hormel always tender bnless pork loin frsh pork,0.76,145.0,2.84,19.02,358.0,0.08,7.18
2687,10857,hormel canadian style bacon,1.87,122.0,1.83,16.88,1016.0,1.43,4.94
2688,10858,pork frsh ln tp ln (chps) bnless ln w added sln ckd pn-brld,0.0,169.0,1.797,28.95,209.0,0.0,5.0
2689,10859,pork frsh ln tpln(chps) bnls ln  ft wadded sln ckd pn-brld,0.0,190.0,2.725,28.35,205.0,0.0,7.66
2690,10860,pork cured bacon ckd bkd,1.35,548.0,14.187,35.73,2193.0,0.0,43.27
2691,10861,pork cured bacon ckd microwaved,0.48,476.0,11.644,39.01,1783.0,0.0,34.12
2692,10862,pork cured bacon pre-sliced ckd pan-fried,1.7,468.0,11.964,33.92,1684.0,0.0,35.09
2693,10863,pork frsh var meats  by-products stomach ckd simmrd,0.09,157.0,2.99,21.4,40.0,0.0,7.26
2694,10864,pork bacon rendered fat ckd,0.0,898.0,31.991,0.07,27.0,0.0,99.5
2695,10865,pork cured ham -- h2o added rump bone-in ln htd rstd,0.87,121.0,1.254,21.41,1150.0,0.84,3.56
2696,10866,pork cured ham -- h2o added rump bone-in ln unhtd,0.67,95.0,1.227,15.43,1170.0,0.67,3.48
2697,10867,pork cured ham -- h2o added shank bone-in ln htd rstd,1.2,128.0,1.402,20.92,1060.0,0.91,4.43
2698,10868,pork cured ham -- h2o added slice bone-in ln htd pan-broil,1.48,131.0,1.439,22.04,1374.0,1.48,4.3
2699,10869,pork cured ham  h2o product slice bone-in ln htd pan-broil,1.35,122.0,1.217,20.9,1237.0,1.1,3.63
2700,10870,pork cured ham  h2o product slice bnless ln htd pan-broil,4.69,123.0,1.528,15.09,1390.0,4.69,5.06
2701,10871,pork cured ham  h2o product whl bnless ln htd rstd,4.61,123.0,1.841,13.88,1335.0,4.61,5.46
2702,10872,pork cured ham  h2o product whl bnless ln unhtd,4.22,116.0,1.4470000000000000,14.07,1310.0,4.22,4.86
2703,10873,pork cured ham w nat juices rump bone-in ln htd rstd,0.48,137.0,1.418,24.14,861.0,0.48,4.25
2704,10874,pork cured ham w nat juices shank bone-in ln htd rstd,0.34,145.0,1.564,24.95,820.0,0.34,4.97
2705,10875,pork cured ham w nat juices slice bone-in ln htd pan-broil,0.0,150.0,1.11,27.75,835.0,0.0,4.38
2706,10876,prk crd ham w nat jucs sprl slc meat only bnles ln htd rstd,1.08,126.0,0.493,22.56,986.0,1.08,3.78
2707,10877,pork cured ham  h2o product rump bone-in ln htd rstd,1.15,131.0,1.536,21.28,1267.0,1.15,4.7
2708,10878,pork cured ham -- h2o added slice bnless ln htd pan-broil,1.75,119.0,1.401,18.82,1223.0,1.75,4.09
2709,10879,pork cured ham -- h2o added whl bnless ln htd rstd,1.57,117.0,1.4240000000000000,17.99,1193.0,1.57,4.39
2710,10880,pork cured ham -- h2o added whl bnless ln unhtd,1.45,110.0,1.4280000000000000,17.34,1141.0,1.45,3.97
2711,10881,pork cured ham  h2o product shank bone-in ln htd rstd,1.26,132.0,1.471,21.69,1045.0,1.26,4.45
2712,10882,pork cured ham w nat juices slice bnless ln htd pan-broil,1.05,116.0,0.975,20.95,1163.0,1.05,3.16
2713,10883,pork cured ham w nat juices whl bnless ln htd rstd,0.84,113.0,1.044,20.57,1180.0,0.81,3.01
2714,10884,pork cured ham w nat juices whl bnless ln unhtd,1.03,111.0,0.934,19.44,1098.0,1.03,3.21
