,NDB_No,Descrip,Carb_g,Energy_kcal,Saturated_fats_g,Protein_g,Sodium_mg,Sugar_g,Fat_g
6886,21388,fast foods miniature cinn rolls,53.38,403.0,4.7010000000000000,7.02,554.0,17.98,17.95
6887,21389,fast foods hamburger; double lrg paty; w condmnt veg  mayo,13.74,252.0,5.773,13.94,289.0,3.52,15.66
6888,21390,ft fds  hambrger; sin  lrg patty; w condmnts  veg  mayo,17.33,226.0,3.972,11.34,342.0,4.0,12.37
6889,21393,fast foods hmburgr; sng reg ptty; dbl bn w cndmnt  spl sau,22.69,259.0,4.24,12.17,386.0,0.0,13.3
6890,21395,fast foods cheeseburger; double reg patty; w condmnt,17.97,282.0,6.96,16.24,617.0,4.16,16.18
6891,21396,fast foods cheeseburger; double lrg patty; w condmnt,14.43,272.0,6.473,16.96,480.0,3.49,16.22
6892,21397,fast foods chesebrger; sing lrg paty; w condmnt veg  mayo,17.73,268.0,5.746,13.69,473.0,4.5,15.8
6893,21398,fast foods cheeseburger; single lrg patty; w condmnt,19.72,269.0,7.033,15.21,591.0,3.6,14.4
6894,21399,fast fds chseburger; double lrg patty; w condmnt veg  mayo,12.62,253.0,6.519,15.5,405.0,3.61,15.63
6895,21400,fast foods chsburgr; dbl rg ptty; dbl bn w cndmnt  spl sau,21.53,261.0,5.045,11.94,485.0,3.26,14.1
6896,21401,fast foods chick tenders,17.25,271.0,2.4930000000000000,19.22,769.0,0.4,13.95
6897,21402,mcdonald's premium grilled chick classic sndwch,22.28,183.0,0.865,14.16,410.0,5.01,4.29
6898,21403,mcdonald's premium crispy chick classic sndwch,25.46,228.0,1.409,12.08,430.0,5.37,8.68
6899,21404,mcdonald's premium grilled chick club sndwch,19.87,221.0,2.89,17.19,462.0,2.89,8.05
6900,21405,mcdonald's premium crispy chick club sndwch,22.61,250.0,3.333,15.38,472.0,4.99,11.76
6901,21406,mcdonald's premium grilled chick ranch blt sndwch,21.91,204.0,1.463,16.7,495.0,5.2,5.41
6902,21407,mcdonald's premium crispy chick ranch blt sndwch,24.93,244.0,1.971,14.7,488.0,5.53,9.55
6903,21410,fast foods bagel w egg sausage patty chs  condmnt,22.64,295.0,6.396,12.98,550.0,2.87,16.97
6904,21411,fast foods bagel w brkfst steak egg chs  condmnt,22.99,282.0,5.419,15.95,642.0,2.97,14.07
6905,21412,light ice crm soft serve blended w milk choc candies,26.82,182.0,3.633,4.02,54.0,24.37,6.46
6906,21413,light ice crm soft serve blended w cookie pieces,25.55,169.0,2.754,3.97,75.0,21.19,5.66
6907,21415,popeyes biscuit,40.95,401.0,11.515,6.0,745.0,3.46,23.71
6908,21416,popeyes coleslaw,14.12,161.0,1.887,0.98,218.0,10.83,11.18
6909,21417,popeyes mild chick strips analyzed 2006,19.31,271.0,5.442,19.2,922.0,0.0,13.01
6910,21418,popeyes spicy chick strips analyzed 2006,18.52,253.0,4.743,19.61,997.0,0.0,11.2
6911,21419,kfc biscuit,43.55,358.0,11.916,7.5,1070.0,4.04,17.05
6912,21420,kfc coleslaw,15.65,144.0,1.3030000000000000,0.91,189.0,13.54,8.64
6913,21421,kfc crispy chick strips,13.66,274.0,2.887,20.25,948.0,0.0,15.42
6914,21422,kfc popcorn chick,21.18,351.0,3.954,17.67,1140.0,0.0,21.74
6915,21424,kfc fried chick original recipe skn  breading,18.79,384.0,6.343,14.17,1042.0,0.0,28.01
6916,21425,kfc fried chick original recipe breast meat nly skn brdng rd,0.0,149.0,1.03,26.89,499.0,0.0,4.56
6917,21426,kfc fried chick original recipe drumstk meat only skn brg rd,0.11,175.0,1.838,26.3,524.0,0.0,7.66
6918,21427,kfc fried chick original recipe thigh meat only skn brdng rd,0.01,175.0,2.3080000000000000,22.78,568.0,0.0,9.31
6919,21428,kfc fried chick original recipe wing meat only skn brdng rd,1.76,216.0,2.321,28.65,738.0,0.0,10.49
6920,21429,kfc fried chick ex crispy skn  breading,22.54,464.0,7.541,10.96,828.0,0.0,36.61
6921,21430,kfc fried chick ex crispy breast meat only skn  brding rmvd,0.25,153.0,1.196,27.25,477.0,0.0,4.82
6922,21431,kfc fried chick ex crispy drumstk meat only skn  brdng rmvd,0.0,170.0,1.893,25.9,526.0,0.0,7.43
6923,21432,kfc fried chick ex crispy thigh meat only skn  brding rmvd,0.0,179.0,2.709,22.41,558.0,0.0,9.96
6924,21433,kfc fried chick ex crispy wing meat only skn  brding removd,2.97,236.0,2.603,28.67,714.0,0.0,12.13
6925,21434,kfc fried chick original recipe breast meat  skn w brding,6.28,231.0,2.9810000000000000,21.94,606.0,0.0,13.11
6926,21435,kfc fried chick original recipe drumstk meat  skn w brding,5.39,239.0,3.24,22.3,625.0,0.0,14.22
6927,21436,kfc fried chick original recipe thigh meat  skn w breading,8.46,269.0,4.123,18.9,781.0,0.0,17.73
6928,21437,kfc fried chick original recipe wing meat  skn w breading,9.93,297.0,4.251,21.7,884.0,0.0,18.9
6929,21438,kfc fried chick ex crispy breast meat  skn w breading,8.47,268.0,3.5380000000000000,21.24,607.0,0.0,16.55
6930,21439,kfc fried chick ex crispy drumstk meat  skn w breading,7.96,274.0,3.887,20.62,632.0,0.0,17.73
6931,21440,kfc fried chick ex crispy thigh meat  skn w breading,10.3,309.0,4.917,17.17,682.0,0.0,22.14
6932,21441,kfc fried chick ex crispy wing meat  skn w breading,11.66,337.0,4.796,20.8,765.0,0.0,23.0
6933,21442,popeyes  chick mild breast meat only skn  brding removed,0.0,157.0,1.368,28.98,526.0,0.0,4.52
6934,21443,popeyes fried chick mild drumstk meat only skn  breading re,0.04,170.0,2.282,26.51,478.0,0.0,7.14
6935,21444,popeyes fried chick mild skn  breading,21.54,433.0,11.75,13.96,769.0,0.0,32.32
6936,21445,popeyes fried chck mild thigh meat only skn  brding removed,0.85,188.0,2.938,24.31,601.0,0.0,9.66
6937,21446,popeyes fried chick mild wing meat only skn  brding removed,2.9,212.0,3.079,28.94,814.0,0.0,9.42
6938,21456,popeyes fried chick mild breast meat  skn w breading,9.83,274.0,5.765,21.67,540.0,0.0,16.47
6939,21457,popeyes fried chick mild drumstk meat  skn w breading,9.84,293.0,6.591,20.44,588.0,0.0,19.14
6940,21458,popeyes fried chick mild thigh meat  skn w breading,11.2,310.0,7.344000000000000,19.14,685.0,0.0,20.99
6941,21459,popeyes fried chick mild wing meat  skn w breading,13.52,338.0,8.021,20.4,788.0,0.0,22.48
6942,21461,grilled chick bacon  tomo clb sndwch w chs lettuce  mayo,19.87,220.0,3.109,17.19,630.0,4.68,8.05
6943,21462,crispy chick bacon  tomato club sndwch w chs letuce  mayo,22.61,257.0,3.372,15.38,605.0,4.99,11.76
6944,21463,yogurt parfait lowfat w fruit  granola,15.86,84.0,0.525,3.36,49.0,11.68,1.01
6945,21464,fast foods fried chick breast meat only skn  brding removed,0.0,153.0,1.18,27.93,512.0,0.0,4.54
6946,21465,fast foods fried chick drmstk meat only skn  brding removed,0.0,172.0,2.004,26.24,492.0,0.0,7.41
6947,21466,fast foods fried chick thigh meat only skn  breding removed,0.24,178.0,2.484,23.21,577.0,0.0,9.41
6948,21467,fast foods fried chick wing meat only skn  breading removed,2.13,215.0,2.651,28.77,761.0,0.0,10.2
6949,21468,fast foods fried chick skn  breading from all pieces,19.56,398.0,7.857,14.11,965.0,0.0,29.22
6950,21469,fast foods fried chick breast meat  skn  breading,6.03,230.0,3.3160000000000000,23.51,657.0,0.0,12.44
6951,21470,fast foods fried chick drumstk meat  skn w breading,7.59,267.0,4.458,21.13,591.0,0.0,16.92
6952,21471,fast foods fried chick thigh meat  skn  breading,8.68,274.0,4.832,19.23,747.0,0.0,18.07
6953,21472,fast foods fried chick wing meat  skn  breading,11.19,310.0,5.358,21.14,867.0,0.0,20.09
6954,21473,digiorno pizza chs topping chs stuffed crust frz bkd,29.86,279.0,5.63,13.48,806.0,0.0,11.68
6955,21474,digiorno pizza chs topping rising crust frz bkd,31.78,256.0,3.514,12.8,696.0,5.0,8.6
6956,21475,digiorno pizza chs topping thin crispy crust frz bkd,26.47,247.0,4.601,12.96,506.0,0.0,9.91
6957,21476,digiorno pizza pepperoni topping chs stuffed crust frz bkd,29.46,279.0,5.007,13.92,753.0,0.0,11.71
6958,21477,digiorno pizza pepperoni topping rising crust frz bkd,31.15,265.0,3.761,12.46,743.0,5.1,10.11
6959,21478,digiorno pizza pepperoni topping thin crispy crust frz bkd,28.67,283.0,4.973,13.22,663.0,0.0,12.86
6960,21479,digiorno pizza supreme topping rising crust frz bkd,27.93,255.0,3.965,11.74,712.0,4.71,10.68
6961,21480,digiorno pizza supreme topping thin crispy crust frz bkd,28.05,255.0,4.377,11.41,555.0,0.0,10.8
6962,21482,"fast fd pizza chain 14"" pizza sausage topping thick crust",30.36,282.0,4.805,11.06,637.0,2.82,12.94
6963,21483,"fast fd pizza chain 14"" pizza sausage topping thin crust",27.0,321.0,6.888,13.36,782.0,3.02,17.71
6964,21484,"fast fd pizza chain 14"" pizza sausage topping reg crust",30.62,280.0,5.033,11.5,633.0,3.32,12.35
6965,21485,"fast fd pizza chain 14"" pizza pepperoni topping thin crust",29.0,331.0,7.115,14.01,875.0,3.22,17.61
6966,21486,fast foods taco w bf chs  lettuce soft,20.23,206.0,4.155,9.25,560.0,1.57,9.75
6967,21487,fast foods taco w chick lettuce  chs soft,19.69,189.0,2.559,13.3,613.0,1.3,6.35
6968,21488,fast foods quesadilla w chick,24.04,294.0,6.154,15.05,745.0,1.88,15.25
6969,21490,fast fds grilled chick filet sndwch w lettuce tomato  sprd,16.78,182.0,0.949,17.34,427.0,3.08,4.57
6970,21491,"pizza hut 14"" pepperoni pizza thin 'n crispy crust",32.66,333.0,6.674,14.13,967.0,2.79,16.17
6971,21492,"domino's 14"" pepperoni pizza crunchy thin crust",25.35,328.0,7.557,13.88,783.0,3.65,19.05
6972,21493,"domino's 14"" sausage pizza crunchy thin crust",25.3,319.0,7.079,12.77,725.0,3.42,18.52
6973,21494,"domino's 14"" sausage pizza classic hand-tossed crust",31.84,273.0,4.607,11.08,594.0,3.92,11.2
6974,21495,"domino's 14"" sausage pizza ultimate deep dish crust",31.17,277.0,4.755,11.03,677.0,3.82,12.03
6975,21496,"pizza hut 14"" sausage pizza thin 'n crispy crust",28.7,323.0,6.698,13.95,839.0,2.62,16.9
6976,21497,"pizza hut 14"" sausage pizza hand-tossed crust",29.39,287.0,5.459,11.92,671.0,2.72,13.5
6977,21498,"pizza hut 14"" sausage pizza pan crust",29.56,287.0,4.855,11.08,596.0,1.82,13.85
6978,21499,kashi pizza rstd veg frz unprep,24.5,224.0,3.3,12.5,546.0,2.9,8.4
6979,21500,kashi pizza mushroom trio  spinach frz unprep,24.6,222.0,4.0,12.7,587.0,2.3,8.3
6980,21501,kashi pizza margherita frz unprep,25.7,230.0,3.5,12.8,560.0,3.3,8.4
6981,21503,kashi pizza mediterranean frz unprep,31.0,231.0,3.2,12.7,531.0,2.8,7.5
6982,21505,pizza chs topping thin crust frz ckd,28.8,263.0,5.698,11.91,471.0,3.71,11.07
6983,21506,burger king double cheeseburger,17.43,282.0,6.922000000000000,16.83,562.0,4.17,16.13
6984,21507,wendy's double stack w chs,15.35,285.0,6.851,18.53,477.0,3.87,16.6
6985,21508,wend'ys crispy chick sndwch,26.36,278.0,2.641,11.72,566.0,3.13,13.93
6986,21509,burger king onion rings,43.58,417.0,4.194,3.86,776.0,5.43,25.23
6987,21510,wendy's dave's hot 'n juicy 14 lb single,17.73,268.0,5.746,13.69,473.0,4.5,15.8
6988,21511,"fast fd pizza chain 14"" pizza chs topping stuffed crust",30.0,274.0,5.825,12.23,615.0,2.9,11.63
6989,21512,"pizza hut 14"" chs pizza stuffed crust",30.0,274.0,5.825,12.23,615.0,2.9,11.63
6990,21513,kashi pizza greek tzatziki single serve frz unprep,29.7,203.0,2.3,11.1,322.0,2.7,6.6
6991,21514,kashi pizza tikka masala single serve frz unprep,29.5,191.0,2.1,10.2,247.0,4.0,5.9
6992,21515,morningstar farms pizza baja black bean single serve frz unp,36.9,235.0,2.7,10.6,261.0,3.3,6.9
6993,21516,kashi pizza mushroom  spinach single serve frz unprep,36.5,229.0,2.3,10.7,337.0,2.5,6.0
6994,21517,fast foods crispy chick in tortilla w lttc chs  ranch sau,23.22,275.0,3.837,11.48,607.0,2.48,15.1
6995,21518,fast foods grilled chick in tortilla w lttc chs  ranch sau,18.43,222.0,3.363,13.77,577.0,1.53,10.31
6996,21519,fast foods brkfst burrito w egg chs  sausage,22.97,277.0,6.404,11.1,744.0,2.57,15.63
6997,21520,fast foods breadstick soft prep w garlic  parmesan chs,44.48,343.0,2.966,12.2,539.0,1.11,12.88
6998,21521,fast foods strwby banana smth made w ice  low-fat yogurt,15.05,65.0,0.0,0.86,14.0,12.68,0.14
6999,21522,mcdonald's southern style chick biscuit,30.56,304.0,5.712000000000000,11.93,868.0,2.62,14.93
7000,21523,mcdonald's ranch snack wrap crispy,23.22,275.0,3.837,11.48,607.0,2.48,15.1
7001,21524,mcdonald's ranch snack wrap grilled,18.43,222.0,3.363,13.77,577.0,1.53,10.31
7002,21525,pizza hut breadstick parmesan garlic,44.48,343.0,2.966,12.2,539.0,1.11,12.88
7003,21526,chick-fil-a chick sndwch,20.89,249.0,2.123,16.28,753.0,3.64,11.19
7004,21527,arby's rst bf sndwch classic,22.21,242.0,3.399,15.17,653.0,3.84,10.3
7005,21600,school lunch pizza chs topping thin crust whl grain frz ckd,31.31,247.0,4.0,12.72,421.0,7.12,7.91
7006,21601,school lunch pizza chs topping thick crust whl grain frz ckd,28.08,254.0,4.3580000000000000,14.62,421.0,5.02,9.27
7007,21602,school lunch pizza peppi topping thin crust whl grn frz ckd,31.24,254.0,2.81,12.78,495.0,7.62,8.62
7008,21603,school lunch pizza pepp topping thick crust whl grn frz ckd,28.3,259.0,4.219000000000000,14.35,474.0,4.03,9.82
7009,21604,school lunch pizza ssage topping thin crst whl grain frz ckd,32.24,250.0,3.488,12.63,457.0,7.53,7.83
7010,21605,school lunch pizza sausage top thick crust whl grn frz ckd,30.58,257.0,4.219000000000000,13.26,433.0,3.72,9.07
7011,21610,school lunch chick patty whl grain breaded,12.5,246.0,2.642,17.64,467.0,0.55,13.93
7012,21611,school lunch chick nuggets whl grain breaded,22.86,270.0,2.83,15.67,511.0,0.49,12.9
7013,22118,worthington foods morningstar farms garden vege patties frz,13.7,176.0,0.8,17.8,525.0,1.8,5.5
7014,22119,worthington foods morningstar farms deli franks,11.2,126.0,0.2,17.4,1076.0,4.4,1.3
7015,22120,morningstar farms grillers brgr styl recipe crmbl frz unprep,8.3,135.0,0.5,18.5,434.0,1.1,4.3
7016,22121,worthington foods morningstar farms better'n burgers frz,9.1,132.0,0.5,16.3,395.0,0.4,3.4
7017,22122,morningstar farms brkfst sausage patties frz unprep,8.8,210.0,1.1,25.8,671.0,1.7,7.9
7018,22123,worthington foods morningstar farms spicy black bean burger,19.1,168.0,0.9,14.6,489.0,1.8,6.1
7019,22126,loma linda big franks cnd unprep,5.8,218.0,1.6,21.5,426.0,0.4,12.1
7020,22247,macaroni  chs cnd entree,11.52,82.0,0.8810000000000000,3.38,302.0,0.5,2.46
7021,22401,spaghetti w meat sau frz entree,15.24,90.0,0.35,5.05,238.0,2.6,1.01
7022,22402,beef macaroni w tomato sau frz entree red fat,17.99,113.0,0.4430000000000000,5.89,178.0,3.8,1.96
7023,22522,pasta wsliced franks in tomato sau cnd entree,12.7,90.0,0.7910000000000000,4.37,287.0,3.17,2.38
7024,22528,turkey pot pie frz entree,17.7,176.0,2.88,6.5,350.0,0.0,8.8
7025,22529,beef pot pie frz entree prep,22.05,220.0,4.149,7.25,365.0,0.0,11.39
7026,22535,hot pockets croissant pockts chik brocchdr stufd sndwch frz,30.4,235.0,2.62,8.9,346.0,7.6,8.6
7027,22537,hot pockets ham 'n chs stuffed sndwch frz,30.55,241.0,3.545,9.16,504.0,7.6,9.14
7028,22899,ravioli cheese-filled cnd,13.64,77.0,0.723,2.48,306.0,3.72,1.45
7029,22900,ravioli meat-filled w tomato sau or meat sau cnd,13.26,97.0,1.46,3.24,283.0,1.97,3.41
7030,22901,tortellini pasta w chs filling fresh-refrigerated,47.0,307.0,3.6,13.5,406.0,0.95,7.23
7031,22902,pizza meat topping thick crust frz ckd,30.76,274.0,4.283,11.76,690.0,3.88,11.52
7032,22903,pizza pepperoni topping reg crust frz ckd,24.69,274.0,4.827,14.38,590.0,3.39,13.13
7033,22904,chili con carne wbns cnd entree,13.1,107.0,1.253,5.8,449.0,1.87,3.47
7034,22905,beef stew canned entree,7.85,99.0,2.185,4.41,388.0,1.76,5.53
7035,22906,chicken pot pie frz entree prep,19.21,204.0,4.365,5.11,393.0,2.26,11.85
7036,22908,beef corned bf hash w potato cnd,9.27,164.0,4.32,8.73,412.0,0.34,10.24
7037,22910,lasagna chs frz prep,13.84,130.0,2.11,6.54,284.0,4.23,5.33
7038,22911,chili no bns cnd entree,6.1,118.0,2.255,7.53,411.0,1.1,7.1
7039,22912,spaghetti w meatballs in tomato sau cnd,11.45,100.0,1.459,4.37,280.0,2.91,4.11
7040,22914,pasta w tomato sau no meat cnd,14.22,70.0,0.136,2.22,272.0,4.0,0.44
7041,22915,lasagna w meat  sau low-fat frz entree,13.5,101.0,0.967,6.81,181.0,0.0,2.23
7042,22916,lasagna w meat  sau frz entree,14.39,124.0,2.067,6.63,347.0,2.96,4.42
7043,22917,burrito bf  bean frz,30.84,239.0,2.949,7.26,587.0,0.7,9.61
7044,22918,burrito  bean and cheese  frozen,34.01,221.0,1.3430000000000000,7.07,351.0,3.21,6.3
7045,22919,macaroni  chs cnd microwavable,13.96,134.0,3.665,5.98,335.0,1.41,5.99
7046,22928,burrito bf  bean microwaved,38.95,298.0,4.072,8.73,659.0,1.36,11.94
7047,22929,campbell's spaghettios mini bf ravioli in meat sau,16.6,99.0,0.772,4.25,409.0,5.41,1.74
7048,22930,campbell's spaghettios spaghetti in tomato  chs sau,15.87,80.0,0.198,2.78,377.0,5.16,0.6
7049,22931,campbell's spaghettios spaghettios original,13.89,67.0,0.198,2.38,238.0,4.37,0.4
7050,22932,campbell's spaghettios spaghettios a to z's,13.89,67.0,0.198,2.38,238.0,4.76,0.4
7051,22937,campbell's spaghettios spaghettios in meat sau,12.3,69.0,0.397,3.17,353.0,4.76,0.79
7052,22938,campbell's spaghettios spaghettios plus ca,13.89,67.0,0.198,2.38,238.0,5.16,0.4
7053,22939,campbell's spaghettios raviolios bf ravioli in meat sau,15.08,106.0,1.389,4.37,433.0,3.57,3.17
7054,22940,spaghettios spaghettios w meatballs,12.7,95.0,0.992,4.37,238.0,3.17,2.78
7055,22941,spaghettios spaghettios w sliced franks,12.7,87.0,0.992,3.57,238.0,3.57,2.38
7056,22942,campbell's spaghettios spaghettios a to z's w meatballs,12.7,95.0,0.992,4.37,238.0,3.17,2.78
7057,22943,supper bakes meal cheesy chick w pasta (chick not included),31.76,198.0,1.176,7.06,988.0,4.71,4.71
7058,22944,supper bakes meal kits creamy stroganoff sau w pasta,24.8,147.0,1.2,4.8,520.0,2.4,3.2
7059,22945,supper bakes meal kits garlic chick w pasta,42.93,220.0,0.488,9.76,741.0,6.83,0.98
7060,22946,supper bakes meal kits herb chick w rice,42.55,197.0,0.532,4.26,830.0,2.13,1.06
7061,22947,supper bakes meal kits lemon chick w herb rice,45.74,210.0,0.532,4.26,830.0,3.19,1.06
7062,22948,supper meal kits savory pork chops w herb stuffing,36.64,181.0,0.591,5.91,922.0,4.73,1.18
7063,22949,supper bakes meal kits southwestern-style chick wrice,39.51,189.0,0.617,4.94,741.0,4.94,1.23
7064,22950,supper bakes meal chick w stuffing (chick not included),34.44,190.0,1.188,5.94,879.0,3.56,3.56
7065,22951,swanson chick a la king,4.03,71.0,1.1740000000000000,4.7,460.0,0.67,4.03
7066,22952,swanson chick  dumplings,9.72,93.0,1.822,4.45,401.0,0.81,4.05
7067,22953,egg rolls pork refr htd,29.5,222.0,1.588,9.94,407.0,5.32,7.17
7068,22954,egg rolls chick refr htd,28.54,197.0,0.964,10.44,478.0,5.57,4.51
7069,22955,egg rolls veg frz prep,31.77,214.0,1.138,5.95,490.0,5.96,6.97
7070,22956,lasagna veg frz bkd,14.18,139.0,2.866,6.87,445.0,2.54,6.04
7071,22957,tky stuffing mshd potato wgravy assorted veg frz microwave,16.32,128.0,0.877,6.97,326.0,4.82,3.89
7072,22958,rice bowl w chick frz entree prep,22.46,126.0,0.327,5.65,333.0,4.07,1.56
7073,22959,macaroni  chs dinner w dry sau mix boxed unckd,70.12,379.0,1.151,13.86,680.0,9.61,4.82
7074,22960,mac  chs dry mix prep w 2 milk  80 stk margarine dry mx,23.93,190.0,1.816,4.89,338.0,4.27,8.28
7075,22961,hot pockets meatballs  mozzarella stuffed sndwch frz,30.45,253.0,4.007,9.32,439.0,7.73,10.47
7076,22962,lean pockets ham n cheddar,32.52,230.0,2.389,10.28,423.0,7.6,6.53
7077,22963,lean pockets meatballs  mozzarella,32.28,240.0,3.087,10.49,557.0,8.81,7.7
7078,22965,campbell's spaghettios original easy open,14.55,70.0,0.235,2.35,225.0,4.23,0.47
7079,22966,campbell's spaghettios w meatballs -,11.65,87.0,0.971,4.37,238.0,3.4,2.43
7080,22969,chili w bns microwavable bowls,10.88,100.0,1.372,5.85,385.0,1.84,3.68
7081,22970,macaroni  chs frz entree,17.28,149.0,2.608,5.6,290.0,1.53,6.41
7082,22971,potato salad w egg,16.18,157.0,1.4370000000000000,1.96,329.0,4.95,9.4
7083,22972,pulled pork in barbecue sau,18.74,168.0,1.416,13.19,666.0,15.2,4.42
7084,22973,corn dogs frz prep,26.96,250.0,3.466,8.57,668.0,7.54,12.02
7085,22974,chicken nuggets dk  white meat preckd frz not rehtd,16.09,268.0,3.5980000000000000,12.02,540.0,0.72,17.31
7086,22975,chicken nuggets white meat preckd frz not rehtd,16.24,261.0,3.366,14.36,538.0,1.27,15.42
7087,22976,ravioli chs w tomato sau frz not prep incl reg  lt entrees,17.31,111.0,1.1910000000000000,4.52,280.0,4.09,2.61
7088,22977,lasagna w meat sau frz prep,15.36,135.0,2.3480000000000000,7.28,373.0,3.11,4.92
7089,22978,chicken tenders breaded frz prep,14.86,240.0,2.437,14.62,527.0,0.57,13.58
7090,22979,kashi black bean mango frz unprep,18.0,115.0,0.0,3.0,134.0,3.0,3.0
7091,22980,kashi chick  chipotle bbq sau w mango frz entree,17.6,108.0,0.3,5.3,219.0,4.7,2.1
7092,22981,kashi chick enchilada w ancho sau frz entree,14.9,111.0,1.0,4.9,243.0,2.0,3.7
7093,22982,kashi steam meal chick fettuccine frz entree,14.0,99.0,0.9,6.2,166.0,1.3,2.7
7094,22983,kashi chick florentine frz entree,11.0,106.0,1.5,7.9,194.0,0.5,3.4
7095,22984,kashi chick pasta pomodoro frz entree,13.0,100.0,0.66,7.0,166.0,1.0,2.3
7096,22985,kashi lemongrass cocnt chick frz entree,13.4,104.0,1.4,6.3,241.0,2.2,2.8
7097,22986,kashi mayan harvest bake frz unprep,21.0,121.0,0.6,3.0,133.0,7.0,3.2
7098,22987,kashi pesto pasta primavera frz unprep,13.0,101.0,0.7,3.8,265.0,1.4,3.8
7099,22988,kashi pilaf 7 whl grain unprep,71.0,375.0,0.93,13.81,5.0,0.8,5.4
7100,22989,kashi red curry chick frz entree,15.6,110.0,1.2,5.9,154.0,3.3,3.0
7101,22990,kashi steam meal rstd garlic chick farfalle frz entree,14.6,103.0,0.6,5.5,213.0,1.4,3.2
7102,22991,kashi steam meal sesame chick frz entree,15.7,110.0,0.8,6.1,233.0,3.0,3.5
7103,22992,kashi southwest style chick frz entree,17.4,109.0,0.3,5.7,240.0,1.0,1.8
7104,22993,kashi spicy black bean enchilada frz unprep,17.7,103.0,0.4,3.0,237.0,1.0,2.8
7105,22994,kashi spinach artichoke pasta frz unprep,15.1,103.0,1.6,5.0,229.0,0.1,3.4
7106,22995,kashi swt  sour chick frz entree,19.0,113.0,0.24,6.0,134.0,8.0,1.13
7107,22996,kashi three chs penne frz unprep,16.8,126.0,2.3,5.7,248.0,1.9,4.0
7108,22997,kashi tuscan veggie bake frz entree,15.0,90.0,0.5,2.0,245.0,3.0,3.2
7109,22998,rice  vermicelli mix chick flavor unprep,75.8,358.0,0.389,10.64,1238.0,2.4,1.32
7110,22999,rice  vermicelli mix chick flavor prep w 80 margarine,23.54,136.0,0.746,2.65,377.0,0.64,3.45
7111,23000,"beef shldr pot rst or stk bnls ln  fat 0"" fat all grds r",0.0,130.0,2.033,21.39,72.0,0.0,4.97
7112,23001,"beef shrt loin prtrhs steak lnfat 18""fat all grds raw",0.0,214.0,5.981,20.49,48.0,0.0,14.06
7113,23002,"beef shrt ln prtrhs stk ln  fat 18"" fat all grds ckd grlld",0.0,276.0,7.481,25.4,64.0,0.0,18.57
7114,23003,"beef shrt loin prtrhs steak lnfat 18""fat sel raw",0.0,208.0,5.696000000000000,20.69,42.0,0.0,13.27
7115,23004,"beef shrt loin prtrhs stk l  f 18"" f sel ckd grilled",0.0,263.0,6.843,26.21,63.0,0.0,16.75
7116,23005,"beef shrt loin t-bone steak lnfat 18""fat all grds raw",0.0,223.0,6.495,20.11,40.0,0.0,15.18
7117,23006,"beef shrt ln t-bne stek ln  fat 18"" fat all grds ckd grlld",0.0,289.0,8.356,24.6,62.0,0.0,20.36
7118,23007,"beef shrt loin t-bone steak lnfat 18""fat sel raw",0.0,215.0,6.211,20.28,52.0,0.0,14.19
7119,23008,"beef shrt loin t-bone steak ln  fat 18"" fat sel ckd grlld",0.0,281.0,7.806,25.18,62.0,0.0,19.22
7120,23030,"beef rnd knuckle tip side steak ln  fat 0"" fat choic raw",0.0,133.0,1.755,21.41,62.0,0.0,4.66
7121,23031,"bf rnd knuckle tip side steak ln  fat 0"" fat ch ckd grilled",0.0,174.0,2.218,28.79,55.0,0.0,5.71
7122,23032,"beef rnd knuckle tip side steak ln  fat 0"" fat sel raw",0.0,124.0,1.225,21.96,57.0,0.0,3.24
7123,23033,"bf rnd knuckle tip side steak ln  fat 0"" fat se ckd grilled",0.0,160.0,1.267,29.24,52.0,0.0,3.91
7124,23034,"bf chk clod shldr tender medallion ln  fat 0"" fat choic raw",0.0,145.0,2.3280000000000000,20.51,59.0,0.0,6.36
7125,23035,"bf chk clod shdr tndr med ln  fat 0"" fat ch ckd grilled",0.0,181.0,2.737,26.07,60.0,0.0,7.68
7126,23036,"bf chk clod shldr tender medallion ln  fat 0"" fat sel raw",0.0,142.0,1.988,20.93,60.0,0.0,5.79
7127,23037,"beef chuck shldr clod top  cntr  stk ln  fat 0"" fat ch raw",0.0,143.0,2.083,20.39,61.0,0.0,6.12
7128,23038,"bf chk shldr clod top  cntr stk ln  fat 0"" fat ch ckd grld",0.0,184.0,3.031,26.07,59.0,0.0,8.11
7129,23039,"bf chuck shldr clod  top  cntr stk ln  fat 0"" fat sel raw",0.0,140.0,1.791,21.13,58.0,0.0,5.51
7130,23040,"bf chk  clod top  cntr stk ln  fat 0"" fat sel ckd grld",0.0,176.0,2.235,26.66,62.0,0.0,6.94
7131,23041,"bf chk shldr clod top blade steak ln  fat 0"" fat choic raw",0.0,182.0,4.186,18.75,74.0,0.0,11.33
7132,23042,"bf chk clod top blade steak ln  fat 0"" fat ch ckd grilled",0.0,228.0,5.432,24.7,78.0,0.0,13.59
7133,23043,"bf chuck shldr clod top blade steak ln  fat 0"" fat sel raw",0.0,166.0,3.464,19.38,75.0,0.0,9.22
7134,23044,"bf chk clod top blade steak ln  fat 0"" fat sel ckd grilled",0.0,212.0,4.423,25.29,76.0,0.0,11.52
7135,23045,"beef rnd knuckle tip cntr steak ln  fat 0"" fat choic raw",0.0,150.0,2.3,20.74,54.0,0.0,6.85
7136,23046,"bf rnd knuckle tip cntr stk ln  fat 0"" fat choic ckd grld",0.0,188.0,2.759,26.88,51.0,0.0,8.13
7137,23047,"beef rnd knuckle tip cntr steak ln  fat 0"" fat sel raw",0.0,137.0,1.89,20.98,53.0,0.0,5.21
7138,23048,"bf rnd knuckle tip cntr steak ln  fat 0"" fat se ckd grilled",0.0,162.0,2.063,26.61,53.0,0.0,5.32
7139,23049,"bf rnd outside rnd bttm rnd steak ln  fat 0"" fat choic raw",0.0,150.0,2.301,21.24,63.0,0.0,6.59
7140,23050,"bf rnd out rnd bttm rnd stk ln  fat 0"" fat ch ckd grilled",0.0,191.0,2.954,27.22,57.0,0.0,8.3
7141,23051,"beef rnd outside rnd bttm rnd steak ln  fat 0"" fat sel raw",0.0,129.0,1.4,22.15,62.0,0.0,3.83
7142,23052,"beef rnd out rnd bttm rnd stk ln  fat 0"" fat sel ckd grld",0.0,166.0,1.716,28.01,60.0,0.0,5.17
7143,23053,"bf chk cld shldr tndr medallion ln  fat 0"" fat all grds raw",0.0,144.0,2.088,20.54,58.0,0.0,6.22
7144,23054,"bf chk cld shdr tndr med ln  fat 0"" fat all grds ck grld",0.0,177.0,2.833,26.22,59.0,0.0,7.2
7145,23055,"beef rnd knuckle tip side steak ln  fat 0"" fat all grds raw",0.0,129.0,1.578,21.69,61.0,0.0,4.0
7146,23056,"bf rnd knuck tip side stk ln  fat 0"" fat all grds ckd grld",0.0,168.0,1.901,29.08,54.0,0.0,4.84
7147,23057,"bf chuck clod top  cntr steak ln  fat 0"" fat all grds raw",0.0,141.0,1.985,20.67,60.0,0.0,5.88
7148,23058,"beef chck clod shldr topcntr stks ln  ft 0"" all grds grld",0.0,182.0,2.765,26.3,60.0,0.0,7.66
7149,23059,"beef chuck clod top blade steak ln  fat 0"" fat all grds raw",0.0,176.0,3.945,18.99,74.0,0.0,10.52
