,NDB_No,Descrip,Carb_g,Energy_kcal,Saturated_fats_g,Protein_g,Sodium_mg,Sugar_g,Fat_g
4805,16068,hyacinth bns mature seeds ckd bld wosalt,20.69,117.0,0.099,8.14,7.0,0.0,0.58
4806,16069,lentils raw,63.35,352.0,0.154,24.63,6.0,2.03,1.06
4807,16070,lentils mature seeds ckd bld wosalt,20.13,116.0,0.053,9.02,2.0,1.8,0.38
4808,16071,lima bns lrg mature seeds raw,63.38,338.0,0.161,21.46,18.0,8.5,0.69
4809,16072,lima bns lrg mature seeds ckd bld wosalt,20.88,115.0,0.089,7.8,2.0,2.9,0.38
4810,16073,lima bns lrg mature seeds cnd,14.91,79.0,0.039,4.93,336.0,0.0,0.17
4811,16074,lima bns thin seeded (baby) mature seeds raw,62.83,335.0,0.2190000000000000,20.62,13.0,8.32,0.93
4812,16075,lima bns thin seeded (baby) mature seeds ckd bld wosalt,23.31,126.0,0.088,8.04,3.0,0.0,0.38
4813,16076,lupins mature seeds raw,40.37,371.0,1.156,36.17,15.0,0.0,9.74
4814,16077,lupins mature seeds ckd bld wo salt,9.88,119.0,0.346,15.57,4.0,0.0,2.92
4815,16078,mothbeans mature seeds raw,61.52,343.0,0.364,22.94,30.0,0.0,1.61
4816,16079,mothbeans mature seeds ckd bld wosalt,20.96,117.0,0.124,7.81,10.0,0.0,0.55
4817,16080,mung bns mature seeds raw,62.62,347.0,0.348,23.86,15.0,6.6,1.15
4818,16081,mung bns mature seeds ckd bld wosalt,19.15,105.0,0.1160000000000000,7.02,2.0,2.0,0.38
4819,16082,noodles chinese cellophane or long rice (mung bns) dehyd,86.09,351.0,0.017,0.16,10.0,0.0,0.06
4820,16083,mungo bns mature seeds raw,58.99,341.0,0.114,25.21,38.0,0.0,1.64
4821,16084,mungo bns mature seeds ckd bld wosalt,18.34,105.0,0.038,7.54,7.0,2.01,0.55
4822,16085,peas grn split mature seeds raw,63.74,352.0,0.161,23.82,15.0,8.0,1.16
4823,16086,peas split mature seeds ckd bld wosalt,21.1,118.0,0.054,8.34,2.0,2.9,0.39
4824,16087,peanuts all types raw,16.13,567.0,6.279,25.8,18.0,4.72,49.24
4825,16088,peanuts all types ckd bld wsalt,21.26,318.0,3.055,13.5,751.0,2.47,22.01
4826,16089,peanuts all types oil-roasted wsalt,15.26,599.0,8.655,28.03,320.0,4.18,52.5
4827,16090,peanuts all types dry-roasted wsalt,21.26,587.0,7.723,24.35,410.0,4.9,49.66
4828,16091,peanuts spanish raw,15.83,570.0,7.098,26.15,22.0,0.0,49.6
4829,16092,peanuts spanish oil-roasted wsalt,17.45,579.0,7.555,28.01,433.0,0.0,49.04
4830,16093,peanuts valencia raw,20.91,570.0,7.329,25.09,1.0,0.0,47.58
4831,16094,peanuts valencia oil-roasted wsalt,16.3,589.0,7.894,27.04,772.0,0.0,51.24
4832,16095,peanuts virginia raw,16.54,563.0,6.434,25.19,10.0,3.95,48.75
4833,16096,peanuts virginia oil-roasted wsalt,19.86,578.0,6.345,25.87,433.0,0.0,48.62
4834,16097,peanut butter chunk style wsalt,21.57,589.0,7.607,24.06,486.0,8.41,49.94
4835,16098,peanut butter smooth style w salt,22.31,598.0,10.325,22.21,426.0,10.49,51.36
4836,16099,peanut flour defatted,34.7,327.0,0.063,52.2,180.0,8.22,0.55
4837,16100,peanut flour low fat,31.27,428.0,3.04,33.8,1.0,0.0,21.9
4838,16101,pigeon peas (red gm) mature seeds raw,62.78,343.0,0.33,21.7,17.0,0.0,1.49
4839,16102,pigeon peas (red gm) mature seeds ckd bld wosalt,23.25,121.0,0.083,6.76,5.0,0.0,0.38
4840,16103,refried bns cnd traditional style (includes usda commodity),13.55,90.0,0.631,4.98,370.0,0.54,2.01
4841,16104,bacon meatless,5.31,309.0,4.622,11.69,1465.0,0.0,29.52
4842,16106,meat extender,34.71,311.0,0.424,41.71,10.0,0.0,2.97
4843,16107,sausage meatless,8.09,255.0,2.926,20.28,888.0,0.0,18.16
4844,16108,soybeans mature seeds raw,30.16,446.0,2.884,36.49,2.0,7.33,19.94
4845,16109,soybeans mature ckd bld wosalt,8.36,172.0,1.297,18.21,1.0,3.0,8.97
4846,16110,soybeans mature seeds rstd salted,30.22,469.0,3.674,38.55,163.0,4.2,25.4
4847,16111,soybeans mature seeds dry rstd,28.98,449.0,3.127,43.32,2.0,0.0,21.62
4848,16112,miso,25.37,198.0,1.025,12.79,3728.0,6.2,6.01
4849,16113,natto,12.68,211.0,1.591,19.4,7.0,4.89,11.0
4850,16114,tempeh,7.64,192.0,2.539,20.29,9.0,0.0,10.8
4851,16115,soy flour full-fat raw,31.92,434.0,2.987,37.81,13.0,7.5,20.65
4852,16116,soy flr full-fat rstd,30.38,439.0,3.162,38.09,12.0,7.61,21.86
4853,16117,soy flour defatted,33.92,327.0,0.136,51.46,20.0,16.42,1.22
4854,16118,soy flour low-fat,30.63,372.0,1.29,49.81,9.0,9.33,8.9
4855,16119,soy meal defatted raw,35.89,337.0,0.268,49.2,3.0,0.0,2.39
4856,16120,soymilk original  vanilla unfortified,6.28,54.0,0.205,3.27,51.0,3.99,1.75
4857,16121,soy prot conc produced by alcohol extraction,25.41,328.0,0.052,63.63,3.0,20.0,0.46
4858,16122,soy protein isolate,0.0,335.0,0.422,88.32,1005.0,0.0,3.39
4859,16123,soy sau made from soywheat (shoyu),4.93,53.0,0.073,8.14,5493.0,0.4,0.57
4860,16124,soy sau made from soy (tamari),5.57,60.0,0.011,10.51,5586.0,1.7,0.1
4861,16125,soy sau made from hydrolyzed veg prot,7.84,60.0,0.04,7.0,6820.0,1.3,0.51
4862,16126,tofu firm prep wca sulfatemagnesium chloride (nigari),2.85,78.0,0.7930000000000000,9.04,12.0,0.6,4.17
4863,16127,tofu soft prep wca sulfatemagnesium chloride (nigari),1.18,61.0,0.5330000000000000,7.17,8.0,0.7,3.69
4864,16128,tofu dried-frozen (koyadofu),10.03,477.0,4.388,52.47,6.0,0.0,30.34
4865,16129,tofu fried,8.86,270.0,2.918,18.82,16.0,2.72,20.18
4866,16130,okara,12.23,76.0,0.193,3.52,9.0,0.0,1.73
4867,16132,tofu saltedfermented (fuyu),4.38,116.0,1.157,8.92,2873.0,0.0,8.0
4868,16133,yardlong bns mature seeds raw,61.91,347.0,0.3390000000000000,24.33,17.0,0.0,1.31
4869,16134,yardlong bns mature seeds ckd bld wosalt,21.09,118.0,0.1160000000000000,8.29,5.0,0.0,0.45
4870,16135,winged bns mature seeds raw,41.71,409.0,2.303,29.65,38.0,0.0,16.32
4871,16136,winged bns mature seeds ckd bld wo salt,14.94,147.0,0.825,10.62,13.0,0.0,5.84
4872,16137,hummus home prep,20.12,177.0,1.141,4.86,242.0,0.27,8.59
4873,16138,falafel home-prepared,31.84,333.0,2.383,13.31,294.0,0.0,17.8
4874,16139,soymilk original  vanilla w added ca vitamins a  d,4.92,43.0,0.205,2.6,47.0,3.65,1.47
4875,16144,lentils pink or red raw,63.1,358.0,0.379,23.91,7.0,0.0,2.17
4876,16145,beans kidney red mature seeds cnd drnd sol,21.49,124.0,0.181,7.98,231.0,3.8,1.05
4877,16146,beans pinto cnd drnd sol,20.22,114.0,0.158,6.99,239.0,0.54,0.9
4878,16147,veggie burgers or soyburgers  unprep,14.27,177.0,1.44,15.7,569.0,1.07,6.3
4879,16149,peanut sprd red sugar,14.23,650.0,10.22,24.8,292.0,6.35,54.89
4880,16150,peanut butter smooth red fat,35.65,520.0,5.76,25.9,540.0,9.28,34.0
4881,16155,peanut butter smooth vit  mineral fort,18.75,591.0,10.125,25.72,420.0,10.47,50.81
4882,16156,peanut butter chunky vitaminmineral fort,17.69,593.0,7.972,26.06,366.0,10.94,51.47
4883,16157,chickpea flour (besan),57.82,387.0,0.693,22.39,64.0,10.85,6.69
4884,16158,hummus commercial,14.29,166.0,1.4370000000000000,7.9,379.0,0.0,9.6
4885,16159,tofu ex firm prep wnigari,1.18,83.0,0.919,9.98,4.0,0.71,5.26
4886,16160,tofu hard prep wnigari,4.39,145.0,1.445,12.68,2.0,0.0,9.99
4887,16161,mori-nu tofu silken soft,2.9,55.0,0.357,4.8,5.0,1.31,2.7
4888,16162,mori-nu tofu silken firm,2.4,62.0,0.406,6.9,36.0,1.27,2.7
4889,16163,mori-nu tofu silken ex firm,2.0,55.0,0.3,7.4,63.0,0.99,1.9
4890,16164,mori-nu tofu silken lite firm,1.1,37.0,0.133,6.3,85.0,0.45,0.8
4891,16165,mori-nu tofu silken lite ex firm,1.0,38.0,0.1160000000000000,7.0,98.0,0.42,0.7
4892,16166,soymilk choc unfortified,9.95,63.0,0.24,2.26,53.0,7.86,1.53
4893,16167,usda cmdty pnut butter smooth,23.98,588.0,9.519,21.93,476.0,6.5,49.54
4894,16168,soymilk choc w added ca vitamins a  d,9.95,63.0,0.24,2.26,53.0,7.86,1.53
4895,16171,refried bns cnd vegetarian,13.5,83.0,0.142,5.28,430.0,0.59,0.87
4896,16172,refried bns cnd fat-free,13.5,79.0,0.093,5.34,438.0,0.61,0.45
4897,16173,frijoles rojos volteados (refried bns red canned),15.47,144.0,0.926,5.0,375.0,0.0,6.93
4898,16174,tempeh ckd,7.62,195.0,3.4,19.91,14.0,0.0,11.38
4899,16200,campbell's brn sugarbacon flav bkd bns,23.08,123.0,0.385,3.85,362.0,10.0,1.92
4900,16201,campbell's pork  bns,19.23,108.0,0.385,4.62,338.0,6.15,1.15
4901,16202,pace traditional refried bns,10.83,67.0,0.0,4.17,575.0,2.5,0.0
4902,16203,pace salsa refried bns,11.67,60.0,0.0,3.33,492.0,3.33,0.0
4903,16204,pace spicy jalapeno refried bns,11.67,63.0,0.0,4.17,492.0,3.33,0.0
4904,16210,vitasoy usa nasoya lite firm tofu,1.3,54.0,0.2,8.3,34.0,0.2,1.7
4905,16211,vitasoy usa organic nasoya super firm cubed tofu,2.8,118.0,1.3,12.4,6.0,0.6,6.3
4906,16212,vitasoy usa organic nasoya ex firm tofu,2.6,98.0,0.7,10.1,4.0,0.4,5.2
4907,16213,vitasoy usa organic nasoya firm tofu,2.3,84.0,0.5,8.9,4.0,0.3,4.4
4908,16214,vitasoy usa  organic nasoya silken tofu,1.4,47.0,0.3,4.8,2.0,0.2,2.5
4909,16215,vitasoy usa vitasoy organic creamy original soymilk,4.5,44.0,0.2,2.9,66.0,2.0,1.6
4910,16216,vitasoy usa vitasoy organic classic original soymilk,4.5,47.0,0.21,3.2,66.0,2.0,1.8
4911,16219,vitasoy usa vitasoy lt vanilla soymilk,4.1,30.0,0.18,1.6,49.0,2.9,0.82
4912,16222,soymilk (all flavors) unswtnd w added ca vitamins a  d,1.74,33.0,0.206,2.86,37.0,0.41,1.61
4913,16223,soymilk (all flavors) enhanced,3.45,45.0,0.206,2.94,50.0,2.53,1.99
4914,16225,soymilk original  vanilla lt w added ca vitamins a  d,3.51,30.0,0.005,2.38,48.0,2.61,0.77
4915,16227,soymilk choc  other flavors lt w added ca vitamins a  d,8.24,47.0,0.032,2.1,46.0,7.13,0.64
4916,16228,soymilk original  vanilla lt unswtnd w added ca vit a  d,3.85,34.0,0.078,2.62,63.0,0.41,0.85
4917,16229,soymilk (all flavors) lowfat w added ca vitamins a  d,7.2,43.0,0.0,1.65,37.0,3.5,0.62
4918,16230,soymilk (all flavors) nonfat w added ca vitamins a  d,4.14,28.0,0.0,2.47,57.0,3.65,0.04
4919,16231,soymilk choc nonfat w added ca vitamins a  d,8.51,44.0,0.0,2.47,57.0,3.65,0.04
4920,16235,silk pln soymilk,3.29,41.0,0.206,2.88,49.0,2.47,1.65
4921,16236,silk vanilla soymilk,4.12,41.0,0.206,2.47,39.0,2.88,1.44
4922,16237,silk choc soymilk,9.47,58.0,0.206,2.06,41.0,7.82,1.44
4923,16238,silk lt pln soymilk,3.29,29.0,0.0,2.47,49.0,2.47,0.82
4924,16239,silk lt vanilla soymilk,4.12,33.0,0.0,2.47,39.0,2.88,0.82
4925,16240,silk lt choc soymilk,9.05,49.0,0.0,2.06,41.0,7.82,0.62
4926,16241,silk plus omega-3 dha soymilk,3.29,45.0,0.206,2.88,49.0,2.47,2.06
4927,16242,silk plus for bone health soymilk,4.53,41.0,0.206,2.47,39.0,2.88,1.44
4928,16243,silk plus fiber soymilk,5.76,41.0,0.206,2.47,39.0,2.88,1.44
4929,16244,silk unswtnd soymilk,1.65,33.0,0.206,2.88,35.0,0.41,1.65
4930,16245,silk very vanilla soymilk,7.82,53.0,0.206,2.47,58.0,6.58,1.65
4931,16246,silk nog soymilk,12.3,74.0,0.0,2.46,61.0,9.84,1.64
4932,16247,silk chai soymilk,7.82,53.0,0.206,2.47,41.0,5.76,1.44
4933,16248,silk mocha soymilk,9.05,58.0,0.206,2.06,41.0,7.41,1.44
4934,16249,silk coffee soymilk,10.29,62.0,0.206,2.06,41.0,9.47,1.44
4935,16250,silk vanilla soy yogurt (family size),13.66,79.0,0.22,2.64,13.0,10.57,1.76
4936,16251,silk vanilla soy yogurt (single serving size),14.71,88.0,0.0,2.94,12.0,10.59,1.76
4937,16252,silk pln soy yogurt,9.69,66.0,0.22,2.64,13.0,5.29,1.76
4938,16253,silk strawberry soy yogurt,18.24,94.0,0.0,2.35,15.0,12.94,1.18
4939,16254,silk raspberry soy yogurt,17.65,88.0,0.0,2.35,15.0,12.94,1.18
4940,16255,silk peach soy yogurt,18.82,94.0,0.0,2.35,15.0,14.71,1.18
4941,16256,silk black cherry soy yogurt,17.06,88.0,0.0,2.35,12.0,11.76,1.18
4942,16257,silk blueberry soy yogurt,17.06,88.0,0.0,2.35,15.0,12.35,1.18
4943,16258,silk key lime soy yogurt,17.65,88.0,0.0,2.35,15.0,12.35,1.18
4944,16259,silk banana-strawberry soy yogurt,17.06,88.0,0.0,2.35,15.0,10.59,1.18
4945,16260,silk original creamer,6.67,100.0,0.0,0.0,67.0,0.0,6.67
4946,16261,silk french vanilla creamer,20.0,133.0,0.0,0.0,67.0,20.0,6.67
4947,16262,silk hazelnut creamer,20.0,133.0,0.0,0.0,67.0,20.0,6.67
4948,16271,vitasoy usa organic nasoya soft tofu,0.74,70.0,0.5,8.76,4.0,0.3,3.5
4949,16272,vitasoy usa nasoya lite silken tofu,0.0,43.0,0.2,8.21,79.0,0.0,1.1
4950,16273,vitasoy usa organic nasoya tofu plus ex firm,1.82,92.0,0.6,10.18,7.0,0.4,4.9
4951,16274,vitasoy usa organic nasoya tofu plus firm,1.71,74.0,0.3,9.19,4.0,0.3,3.4
4952,16275,vitasoy usa organic nasoya sprouted tofu plus super firm,2.16,115.0,1.1,13.24,28.0,1.1,5.9
4953,16276,vitasoy usa azumaya ex firm tofu,1.53,88.0,0.6,10.07,26.0,0.5,4.6
4954,16277,vitasoy usa azumaya firm tofu,1.52,80.0,0.5,9.08,23.0,0.4,4.2
4955,16278,vitasoy usa azumaya silken tofu,0.58,43.0,0.3,4.82,2.0,0.2,2.4
4956,16279,house foods premium soft tofu,2.19,59.0,0.48,6.38,34.0,0.53,2.71
4957,16281,house foods premium firm tofu,0.97,85.0,0.71,10.92,33.0,0.4,4.19
4958,16302,beans adzuki mature sd ckd bld wsalt,24.77,128.0,0.036,7.52,244.0,0.0,0.1
4959,16315,beans black mature seeds ckd bld wsalt,23.71,132.0,0.139,8.86,237.0,0.32,0.54
4960,16316,beans black mature seeds cnd lo na,16.55,91.0,0.075,6.03,138.0,0.23,0.29
4961,16317,beans black turtle mature seeds ckd bld w salt,24.35,130.0,0.089,8.18,239.0,0.32,0.35
4962,16320,beans cranberry (roman) mature seeds ckd bld wsalt,24.46,136.0,0.119,9.34,237.0,0.0,0.46
4963,16323,beans french mature seeds ckd bld wsalt,24.02,129.0,0.083,7.05,242.0,0.0,0.76
4964,16325,beans great northern mature seeds ckd bld wsalt,21.09,118.0,0.14,8.33,238.0,0.0,0.45
4965,16326,beans great northern mature seeds cnd lo na,21.02,114.0,0.12,7.37,177.0,1.41,0.39
4966,16328,beans kidney all types mature seeds ckd bld wsalt,22.8,127.0,0.072,8.67,238.0,0.32,0.5
4967,16331,beans kidney california red mature seeds ckd bld wsalt,22.41,124.0,0.0139999999999999,9.13,240.0,0.0,0.09
4968,16333,beans kidney red mature seeds ckd bld wsalt,22.8,127.0,0.072,8.67,238.0,0.32,0.5
4969,16335,beans kidney red mature seeds cnd drnd sol rinsed in tap h2o,20.8,121.0,0.3280000000000000,8.12,208.0,0.0,0.93
4970,16336,beans kidney royal red mature seeds ckd bld wsalt,21.85,123.0,0.024,9.49,241.0,0.0,0.17
4971,16337,beans kidney red mature seeds cnd sol  liq lo na,14.83,81.0,0.125,5.22,117.0,1.85,0.36
4972,16338,beans navy mature seeds ckd bld wsalt,26.05,140.0,0.032,8.23,237.0,0.37,0.62
4973,16341,beans pink mature seeds ckd bld wsalt,27.91,149.0,0.126,9.06,238.0,0.36,0.49
4974,16343,beans pinto mature seeds ckd bld wsalt,26.22,143.0,0.109,9.01,238.0,0.34,0.65
4975,16345,beans pinto mature seeds cnd drnd sol rinsed in tap h2o,20.77,117.0,0.0,7.04,212.0,0.0,0.97
4976,16346,beans sml white mature seeds ckd bld wsalt,25.81,142.0,0.166,8.97,238.0,0.0,0.64
4977,16347,beans pinto mature seeds cnd sol  liquids lo na,15.18,82.0,0.1160000000000000,4.6,146.0,1.02,0.56
4978,16348,beans yel mature seeds ckd bld wsalt,25.28,144.0,0.2790000000000000,9.16,241.0,0.34,1.08
4979,16350,beans white mature seeds ckd bld w salt,25.09,139.0,0.091,9.73,242.0,0.34,0.35
4980,16353,broadbeans (fava bns) mature seeds ckd bld wsalt,19.65,110.0,0.066,7.6,241.0,1.82,0.4
4981,16357,chickpeas mature seeds ckd bld wsalt,27.42,164.0,0.2690000000000000,8.86,243.0,4.8,2.59
4982,16358,chickpeas mat seeds cnd drnd sol,22.53,139.0,0.214,7.05,246.0,4.01,2.77
4983,16359,chickpeas mature seeds cnd drnd rinsed in tap h2o,22.87,138.0,0.213,7.04,212.0,4.0,2.47
4984,16360,chickpeas mature seeds cnd sol  liquids lo na,13.49,88.0,0.204,4.92,132.0,2.59,1.95
4985,16361,cowpeas catjang mature seeds ckd bld wsalt,20.32,117.0,0.185,8.13,255.0,0.0,0.71
4986,16363,cowpeas common mature seeds ckd bld wsalt,20.76,116.0,0.138,7.73,240.0,3.3,0.53
4987,16368,hyacinth bns mature seeds ckd bld wsalt,20.7,117.0,0.099,8.14,243.0,0.0,0.58
4988,16370,lentils mature seeds ckd bld wsalt,19.54,114.0,0.053,9.02,238.0,1.8,0.38
4989,16372,lima bns lrg mature seeds ckd bld wsalt,20.88,115.0,0.089,7.8,238.0,2.9,0.38
4990,16375,lima bns thin seeded (baby) mature seeds ckd bld wsalt,23.31,126.0,0.088,8.04,239.0,0.0,0.38
4991,16377,lupins mature seeds ckd bld wsalt,9.29,116.0,0.346,15.57,240.0,0.0,2.92
4992,16379,mothbeans mature seeds ckd bld wsalt,20.96,117.0,0.124,7.81,246.0,0.0,0.55
4993,16381,mung bns mature seeds ckd bld wsalt,19.15,105.0,0.1160000000000000,7.02,238.0,2.0,0.38
4994,16384,mungo bns mature seeds ckd bld wsalt,18.34,105.0,0.038,7.54,243.0,2.01,0.55
4995,16386,peas split mature seeds ckd bld wsalt,20.51,116.0,0.054,8.34,238.0,2.9,0.39
4996,16389,peanuts all types oil-roasted wo salt,15.26,599.0,8.686,28.03,6.0,4.18,52.5
4997,16390,peanuts all types dry-roasted wosalt,21.26,587.0,7.723,24.35,6.0,4.9,49.66
4998,16392,peanuts spanish oil-roasted wosalt,17.45,579.0,7.555,28.01,6.0,0.0,49.04
4999,16394,peanuts valencia oil-roasted wosalt,16.3,589.0,7.894,27.04,6.0,0.0,51.24
5000,16396,peanuts virginia oil-roasted wosalt,19.86,578.0,6.345,25.87,6.0,0.0,48.62
5001,16397,peanut butter chunk style wosalt,21.57,589.0,7.607,24.06,17.0,8.41,49.94
5002,16398,peanut butter smooth style wosalt,22.31,598.0,10.325,22.21,17.0,10.49,51.36
5003,16399,peanut butter w omega-3 creamy,17.0,608.0,9.691,24.47,356.0,3.11,54.17
5004,16402,pigeon peas (red gm) mature seeds ckd bld wsalt,23.25,121.0,0.083,6.76,241.0,0.0,0.38
5005,16403,refried bns cnd traditional red na,13.55,89.0,0.631,4.98,138.0,0.54,2.01
5006,16409,soybeans mature seeds ckd bld wsalt,8.36,172.0,1.297,18.21,237.0,2.36,8.97
5007,16410,soybeans mature seeds rsted no salt added,30.22,469.0,3.674,38.55,4.0,0.0,25.4
5008,16420,soy prot conc produced by acid wash,25.41,328.0,0.052,63.63,900.0,20.0,0.46
5009,16422,soy prot isolate k type,2.59,321.0,0.077,88.32,50.0,0.0,0.53
5010,16424,soy sau made from soywheat (shoyu) lo na,5.59,57.0,0.035,9.05,3598.0,0.5,0.3
5011,16425,soy sau red na made from hydrolyzed veg prot,14.44,90.0,0.02,8.19,2890.0,5.63,0.31
5012,16426,tofu raw firm prep wca sulfate,2.78,144.0,1.261,17.27,14.0,0.0,8.72
5013,16427,tofu raw reg prep wca sulfate,1.87,76.0,0.691,8.08,7.0,0.62,4.78
5014,16428,tofu dried-frozen (koyadofu) prep wca sulfate,8.3,470.0,4.388,52.43,6.0,0.0,30.34
5015,16429,tofu fried prep wca sulfate,8.86,270.0,2.918,18.82,16.0,0.0,20.18
5016,16432,tofu saltedfermented (fuyu) prep wca sulfate,5.15,116.0,1.157,8.15,2873.0,0.0,8.0
5017,16434,yardlong bns mature seeds ckd bld w salt,21.09,118.0,0.1160000000000000,8.29,241.0,0.0,0.45
5018,16436,winged bns mature seeds ckd bld w salt,14.94,147.0,0.825,10.62,249.0,0.0,5.84
5019,16500,loma linda little links cnd unprep,5.5,221.0,2.0,19.4,472.0,0.8,13.5
5020,16502,loma linda lofat big franks cnd unprep,4.9,154.0,0.5,23.1,481.0,0.3,4.7
5021,16504,loma linda tender rounds w gravy cnd unprep,7.4,145.0,0.7,16.3,443.0,1.0,5.6
5022,16505,loma linda swiss stake w gravy cnd unprep,10.4,138.0,0.8,10.2,471.0,0.9,6.2
5023,16506,loma linda vege-burger cnd unprep,3.7,114.0,0.2,22.2,222.0,0.8,1.2
5024,16507,loma linda redi-burger cnd unprep,8.2,146.0,0.4,21.9,508.0,1.2,2.8
5025,16508,loma linda tender bits cnd unprep,8.3,135.0,0.7,15.1,613.0,0.6,4.6
5026,16509,loma linda linketts cnd unprep,4.4,209.0,1.6,21.3,401.0,0.3,11.8
5027,16510,worthington chili cnd unprep,10.9,126.0,0.7,10.4,453.0,1.3,4.5
5028,16511,worthington choplets cnd unprep,4.1,103.0,0.1,19.4,456.0,0.4,1.0
5029,16512,worthington diced chik cnd unprep,3.7,80.0,0.0,14.7,344.0,0.1,0.7
5030,16513,worthington frichik original cnd unprep,3.4,160.0,1.4,13.4,401.0,0.1,10.3
5031,16514,worthington lofat fri chik cnd unprep,4.9,102.0,0.4,14.3,416.0,0.0,2.7
5032,16515,worthington lofat veja-links cnd unprep,4.3,123.0,0.7,15.8,612.0,0.7,4.8
5033,16516,worthington multigrain cutlets cnd unprep,7.3,117.0,0.3,23.29,371.0,0.2,1.5
5034,16517,worthington prime stakes cnd unprep,7.5,135.0,1.0,10.2,480.0,0.3,7.2
5035,16518,worthington saucettes cnd unprep,5.6,219.0,0.0,15.0,532.0,0.2,15.2
5036,16519,worthington super links cnd unprep,5.5,219.0,2.1,14.5,708.0,0.6,15.5
5037,16521,worthington veg skallops cnd unprep,4.6,109.0,0.2,19.9,460.0,0.3,1.2
5038,16522,worthington veg steaks cnd unprep,5.1,113.0,0.0,20.7,417.0,0.5,1.2
5039,16523,worthington vegetarian burger cnd unprep,6.2,124.0,0.5,18.6,451.0,0.6,2.9
5040,16524,worthington veja-links cnd unprep,4.1,155.0,1.3,14.6,530.0,0.5,8.9
5041,16525,worthington chic-ketts frz unprep,5.1,200.0,1.5,23.6,642.0,0.1,9.7
5042,16526,worthington meatless chick roll frz unprep,4.3,154.0,1.2,16.1,452.0,0.8,8.0
5043,16527,worthington meatless corned bf roll frz unprep,9.9,245.0,2.3,18.6,758.0,2.1,14.5
5044,16528,worthington dinner rst frz unprep,6.9,213.0,2.4,16.0,671.0,1.0,13.5
5045,16529,worthington fripats frz unprep,8.0,209.0,1.4,23.7,517.0,1.4,9.1
5046,16531,worthington prosage links frz unprep,5.0,143.0,0.9,20.2,819.0,0.8,4.7
5047,16532,worthington prosage roll frz unprep,6.0,261.0,3.4,19.6,667.0,0.2,17.6
5048,16533,worthington smoked turkey roll frz unprep,7.9,251.0,2.3,18.5,859.0,2.4,16.1
5049,16534,worthington stakelets frz unprep,9.6,211.0,1.8,19.7,651.0,1.2,10.4
5050,16535,worthington stripples frz unprep,14.3,346.0,4.2,12.4,1463.0,0.8,26.6
5051,16536,worthington wham (roll) frz unprep,5.7,196.0,1.6,17.8,717.0,3.2,11.3
5052,16538,morningstar farms brkfst pattie w organic soy frz unprep,12.6,220.0,1.0,23.7,690.0,2.2,8.3
5053,16542,morningstar farms brkfst bacon strips frz unprep,14.3,346.0,4.2,12.4,1463.0,0.8,26.6
5054,16546,morningstar farms brkfst sausage links frz unprep,6.8,159.0,0.7,19.2,670.0,1.0,6.1
5055,16548,morningstar farms grillers original frz unprep,8.5,213.0,1.7,23.9,422.0,1.2,9.3
5056,16549,morningstar farms grillers prime frz unprep,5.9,238.0,1.6,24.0,501.0,0.3,13.2
5057,16551,morningstar farms asian veggie patties frz unprep,18.2,158.0,0.9,11.4,741.0,5.0,6.2
5058,16552,morningstar farms mushroom lover's burger frz unprep,9.2,168.0,1.1,14.3,445.0,0.5,8.2
5059,16554,morningstar farms tomato  basil pizza burger frz unprep,14.0,161.0,2.5,15.5,414.0,2.6,8.6
5060,16555,morningstar farms buffalo wings frz unprep,22.6,232.0,1.7,14.1,642.0,2.8,11.0
5061,16556,morningstar farms chik'n nuggets frz unprep,21.8,221.0,1.5,14.4,702.0,2.2,10.0
5062,16557,morningstar farms chik patties frz unprep,22.9,197.0,0.8,11.8,835.0,2.0,7.0
5063,16558,morningstar farms italian herb chik'n pattie frz unprep,31.1,236.0,0.8,13.6,682.0,1.5,7.0
5064,16560,morningstar farms corn dog frz unprep,36.0,208.0,0.6,11.2,666.0,11.0,3.5
5065,16561,morningstar farms corn dog mini frz unprep,32.6,219.0,0.8,13.2,678.0,8.0,4.7
5066,16565,morningstar farms sausage style recipe crumbles frz unprep,9.9,159.0,0.5,20.2,758.0,1.4,4.6
5067,16570,gardenburger black bean chipotle burger frz unprep,22.0,133.0,0.4,6.5,545.0,3.6,3.9
5068,16579,gardenburger original frz unprep,22.1,155.0,2.4,7.2,684.0,0.6,4.6
5069,16581,gardenburger flame grilled burger frz unprep,6.8,122.0,0.4,15.2,445.0,0.4,4.4
5070,16584,gardenburger savory portabella veggie burger frz unprep,22.1,138.0,1.1,5.9,633.0,1.2,3.3
5071,16585,gardenburger sun-dried tomato basil burger frz unprep,23.7,137.0,1.0,5.5,387.0,2.6,3.6
5072,16586,gardenburger veggie medley burger frz unprep,24.0,121.0,0.4,4.1,559.0,2.0,3.6
5073,16587,morningstar farms brkfst sausage patties mpl flav frz unpr,13.6,222.0,0.9,26.3,656.0,5.9,7.2
5074,16588,morningstar farms chik'n grill veggie patties frz unprep,10.2,118.0,0.4,12.8,519.0,0.2,4.8
5075,16590,morningstar farms bbq riblets frz unprep,24.6,150.0,0.3,11.4,438.0,17.2,2.3
5076,16591,worthington leanies frz unprep,6.1,251.0,2.8,19.5,1078.0,1.2,16.5
5077,16592,morningstar farms california turk'y burger frz unprep,12.6,155.0,0.8,14.9,690.0,1.8,7.7
5078,16593,morningstar farms hotspicy veggie sausge patties frz unprep,8.5,185.0,0.9,21.8,551.0,0.2,7.4
5079,16594,morningstar farms lasagna w veggie sausage frz unprep,14.4,96.0,1.0,7.1,208.0,1.7,2.3
5080,16596,morningstar farms grillers qrtr pnd veggie brgr frz unprp,8.9,219.0,1.9,22.8,429.0,0.6,10.5
5081,16600,morningstar farms sesame chik'n entree frz unprep,17.3,116.0,0.4,5.3,196.0,6.0,3.5
5082,16601,morningstar farms grillers chik'n veggie patties frz unprep,10.2,118.0,0.4,12.8,519.0,0.2,4.8
5083,16602,morningstar farms meal starters veggie meatballs frz unprep,9.9,158.0,0.7,17.7,487.0,1.1,5.8
5084,16603,morningstar farms brkfst biscuit sausage egg  chs frz unpre,37.5,257.0,4.2,9.3,568.0,4.0,8.1
5085,16606,morningstar farms mediterranean chickpea frz unprep,19.8,200.0,0.9,15.5,357.0,1.1,6.5
5086,16607,morningstar farms buffalo chik patties frz unprep,25.2,255.0,1.9,12.1,757.0,3.0,12.8
5087,16608,morningstar farms chik patties original frz unprep,20.5,197.0,1.3,11.2,676.0,2.0,9.1
5088,16609,morningstar farms brkfst pattie frz unprep,12.6,195.0,1.0,23.7,690.0,2.2,8.3
5089,16610,morningstar farms rstd garlic  quinoa burger frz unprep,17.8,192.0,1.2,10.7,522.0,2.1,12.1
5090,16611,morningstar farms parmesan garlic wings frz unprep,24.1,227.0,1.2,14.2,616.0,1.3,8.6
5091,16613,mornngstr frms brkfst sndwch ssge eggchs eng muff frz unprp,18.7,205.0,3.1,14.3,639.0,1.1,9.4
5092,16614,mornngstr frms brkfst sndwch scrmblchs eng muff frz unprp,18.9,149.0,2.2,10.4,562.0,0.6,4.8
5093,16615,morningstar farms chipotle black bean crumbles frz unprep,10.2,122.0,0.6,14.4,491.0,1.4,4.1
5094,16616,morningstar farms garden veggie nuggets frz unprep,16.9,197.0,1.1,9.6,420.0,3.5,12.2
5095,16617,morningstar farms spicy blk bean enchilada entree frz unprep,15.9,123.0,1.6,5.8,277.0,1.8,5.2
5096,16618,morningstar farms spicy indian veggie burger frz unprep,17.0,189.0,1.5,9.2,555.0,2.2,11.6
5097,16619,morningstar farms tuscan grns  bns frz unprep,11.7,112.0,3.0,5.9,161.0,2.3,6.3
5098,17000,veal australian rib rib rst ln raw,1.4,134.0,2.053,21.7,83.0,0.0,4.63
5099,17001,"lamb dom comp of rtl cuts lnfat 14""fat choic raw",0.0,267.0,9.47,16.88,58.0,0.0,21.59
5100,17002,"lamb dom comp of rtl cuts lnfat 14""fat choic ckd",0.0,294.0,8.83,24.52,72.0,0.0,20.94
5101,17003,"lamb dom comp of rtl cuts ln 14""fat choic raw",0.0,134.0,1.88,20.29,66.0,0.0,5.25
5102,17004,"lamb dom comp of rtl cuts ln 14""fat choic ckd",0.0,206.0,3.4,28.22,76.0,0.0,9.52
5103,17005,"lamb dom comp of rtl cuts fat 14""fat choic raw",0.0,665.0,32.24,6.65,31.0,0.0,70.61
5104,17006,"lamb dom comp of rtl cuts fat 14""fat choic ckd",0.0,586.0,27.02,12.16,58.0,0.0,59.18
5105,17007,"lamb dom foreshank lnfat 14""fat choic raw",0.0,201.0,5.83,18.91,72.0,0.0,13.38
